Prenda / Sku Lote,Familia,Marca,Modelo,Descripción,Imagenes,Precio Venta,Precio Promoción,Tienda,Tel. Tienda
60045029.1,AUDIFONOS (usado),APPLE,A2931,"AUDIFONOS INALAMBRICOS APPLE A2931 ,AIRPODS SEGUNDA GEN,SERIE F9GRYT6TXF,COLOR BLANCO,EN ESTUCHE,CON CABLE,EN CAJA MISMA MARCA.",ver [1] fotos.,$ 952.00,$ 952.00,Ecatepec Jardines de Morelos,55-5980-4930
60045029.2,AUDIFONOS (usado),APPLE,A2931,"AUDIFONOS INALAMBRICOS APPLE A2931 ,AIRPODS SEGUNDA GEN,SERIE F9GRYT6TXF,COLOR BLANCO,EN ESTUCHE.",ver [1] fotos.,$ 900.00,$ 900.00,Ecatepec Jardines de Morelos,55-5980-4930
217014431.1,AUDIFONOS (usado),JBL,FREEX,JBL FREEX AUDIFONOS SIN CAJA SE REALIZAN PRUEBAS DE FUNCIONAMIENTO,ver [1] fotos.,$ 600.00,$ 600.00,Ecatepec Muzquiz,55-4160-5766
217014886.2,AUDIFONOS (usado),FX,FX13,FX FX13 AUDÍFONOS INALÁMBRICOS EN CAJA Y CABLE DE CORRIENTE SE REALIZAN PRUEBAS DE FUNCIONAMIENTO,ver [1] fotos.,$ 248.00,$ 248.00,Ecatepec Muzquiz,55-4160-5766
217015348.1,AUDIFONOS (usado),HUGO BOSS,28,HUGO BOSS 28 AUDIFONOS COLOR NEGRO CON CAJA NEGRA EN EBUNAS CONDICIONES SE REALIZ PRUEBAS DE FUNCIONAMIENTO,ver [1] fotos.,$ 933.00,$ 933.00,Ecatepec Muzquiz,55-4160-5766
217015668.1,AUDIFONOS (usado),SM,SM,SM SM AUDIFONOS COLOR AZUL CON NEGRO EN EBUNAS CONDIONES,ver [1] fotos.,$ 143.00,$ 143.00,Ecatepec Muzquiz,55-4160-5766
217015970.1,AUDIFONOS (usado),OPPO,ETE41,AUDIFONOS OPPO ETE41 INALAMBRICOS EN CAJA EN BUEN ESTADO,ver [1] fotos.,$ 502.00,$ 502.00,Ecatepec Muzquiz,55-4160-5766
217015981.1,AUDIFONOS (usado),JBL,ENDURANCEPEAK,AUDIFONOS JBL ENDURANCEPEAK CON CARCLE DE CARGA EN ESTUCHE DE CARGA  SE REALIZAN PRUEBAS,ver [1] fotos.,$ 883.00,$ 883.00,Ecatepec Muzquiz,55-4160-5766
217016044.1,AUDIFONOS (usado),BILLBOARD,BBE78600,AUDIFONOS BILLBOARD BBE78600 CON CABLE DE CARGA,ver [1] fotos.,$ 221.00,$ 221.00,Ecatepec Muzquiz,55-4160-5766
217016056.1,AUDIFONOS (usado),BILLBOARD,BBE19801,BILLBOARD BBE19801 AUDIFONOS VERDE MILITAR SIN CARGADOR SE REALIZA PRUEBAA DE FUNCIOAMIENTO,ver [1] fotos.,$ 342.00,$ 342.00,Ecatepec Muzquiz,55-4160-5766
217016056.3,AUDIFONOS (usado),HTC,HTCTWS3,"HTC HTCTWS3 AUDIFONOS VOCOLOR BLANCO CON GRIS SIN CARGADOR SE REALIZA PRUEBAS DE FUNCM,IEMTO",ver [1] fotos.,$ 348.00,$ 348.00,Ecatepec Muzquiz,55-4160-5766
217016096.2,AUDIFONOS (usado),MOTOROLA,MOTOBUDS065,MOTOROLA MOTOBUDS065 AUDIFONOAS COLOR NEGRO CON CJA Y CARGADOR,ver [1] fotos.,$ 368.00,$ 368.00,Ecatepec Muzquiz,55-4160-5766
217016117.1,AUDIFONOS (usado),APPLE,A2566,APPLE A2566 AUDIFONOS BLANCOS SIN CARGADOR SE RALIZA PRUEBAS DE FUNCIONAMIENTO,ver [1] fotos.,"$ 1,000.00","$ 1,000.00",Ecatepec Muzquiz,55-4160-5766
217016242.1,AUDIFONOS (usado),MOTOROLA,MOTOXT220,MOTOROLA MOTOXT220 AUDIFONOS COLOR NEGRO CON CJA SE REALIZA PRUEBAS DE FUNCIOMAINEITNO,ver [1] fotos.,$ 421.00,$ 421.00,Ecatepec Muzquiz,55-4160-5766
217016279.1,AUDIFONOS (usado),JBL,EL0097309,"AUDIFONOS JBL EL0097309 COLO NEGRO, EN BUENAS CONDICIONES, CON CARGADOR, SE REALIZAN PRUEBAS DE FUNCIONAMIENTO",ver [1] fotos.,$ 876.00,$ 876.00,Ecatepec Muzquiz,55-4160-5766
217016342.1,AUDIFONOS (usado),HP,H200,AUDIFONOS HP H200 EN CAJA SE REALIZAN PRUEBAS FUNCIONAL,ver [1] fotos.,$ 221.00,$ 221.00,Ecatepec Muzquiz,55-4160-5766
217016430.1,AUDIFONOS (usado),BOSE,429708,BOSE 429708 AUDIFONOS CLOR BLANCO SE REALIZA PRUEBAS DE FUNCIOMAIENTO,ver [1] fotos.,"$ 1,472.00","$ 1,472.00",Ecatepec Muzquiz,55-4160-5766
62036859.1,AUDIFONOS (usado),JBL,TUNE225TWS125TWS,AUDIFONOS INALAMBRICOS JBL TUNE225TWS125TWS 2 PAR CON BASE CARGA 2 JUEGO DE AUDIFONOS 2 SIN GOMAS ADICIONALES DESGASTE Y DETALLE SPOR USO NO AFECTA FUNCION CABLE DE ALIMENTACION,ver [1] fotos.,$ 805.00,$ 805.00,Ecatepec Palomas,55-5980-4931
62037321.1,AUDIFONOS (usado),HUAWEI,T0010C,"AUDIFONOS HUAWEI T0010C COLOR TURQUESA, DETALLES DE USO, NO AFECTA FUNCION/ SIN CABLE",ver [1] fotos.,$ 421.00,$ 421.00,Ecatepec Palomas,55-5980-4931
62037751.1,AUDIFONOS (usado),JBL,TUNE22PRO,"AUDIFONOS JBL TUNE22PRO COLOR NEGRO, EN CAJA",ver [1] fotos.,$ 402.00,$ 402.00,Ecatepec Palomas,55-5980-4931
62038104.1,AUDIFONOS (usado),APPLE,A2190,"AIRPODS PRO 1 APPLE A2190 COLOR BLANCO, DETALLES POR USO, NO AFECTA FUNCION/ CON FUNDA COLOR VERDE Y CARGADOR",ver [1] fotos.,"$ 1,005.00","$ 1,005.00",Ecatepec Palomas,55-5980-4931
62038145.1,AUDIFONOS (usado),APPLE,A2566,"AIRPODS 3RA GEN APPLE A2566 COLOR BLANCO, DETALLES DE USO, NO AFECTA FUNCION",ver [1] fotos.,"$ 1,206.00","$ 1,206.00",Ecatepec Palomas,55-5980-4931
62038324.1,AUDIFONOS (usado),PLANTRONICS,BLACKWIRE,"PLANTRONICS BLACKWIRE AUDIFONOS P/COMPU ENTRADA US, MICROFONO",ver [1] fotos.,$ 236.00,$ 236.00,Ecatepec Palomas,55-5980-4931
62038452.1,AUDIFONOS (usado),MOTOROLA,XT24431,"MOTOROLA XT24431 AUDIFONOS BLANCOS MALTRATADOS, CABLE TIPO C",ver [1] fotos.,$ 606.00,$ 606.00,Ecatepec Palomas,55-5980-4931
62038479.1,AUDIFONOS (usado),SM,SM,SM SM AUDIFONOS ANDOWL  MALTRATADO POR USO CON CABLE USB EN CAJA,ver [1] fotos.,$ 103.00,$ 103.00,Ecatepec Palomas,55-5980-4931
62038524.1,AUDIFONOS (usado),APPLE,A2190,APPLE A2190 AUDIFONOS BLANCOS CABLE PARA CARGAR,ver [1] fotos.,$ 804.00,$ 804.00,Ecatepec Palomas,55-5980-4931
62038667.1,AUDIFONOS (usado),REDMI,BUDS4LITE,"REDMI BUDS4LITE AUDIFONOS NEGROS BT, CARGADOR, MALTRATADO X USO",ver [1] fotos.,$ 198.00,$ 198.00,Ecatepec Palomas,55-5980-4931
62038679.1,AUDIFONOS (usado),SKULLCANDY,SM,SKULLCANDY SM AUDIFONOS COLOR NEGRO MALTRATADOS,ver [1] fotos.,$ 312.00,$ 312.00,Ecatepec Palomas,55-5980-4931
62038995.1,AUDIFONOS (usado),REDMI,M223E1,AUDIFONOS REDMI BUDS 4 ACTIVE REDMI M223E1 AUDIFONOS COLOR NEGRO,ver [1] fotos.,$ 372.00,$ 372.00,Ecatepec Palomas,55-5980-4931
62039241.3,AUDIFONOS (usado),FX,EAR450RL,FX EAR450RL AUDIFONOS FX COLOR AZUL METALICO EN CAJA,ver [1] fotos.,$ 106.00,$ 106.00,Ecatepec Palomas,55-5980-4931
62039305.1,AUDIFONOS (usado),AIRBUDS,NC1,OTRA MARCA(AIRBUDS) NC1,ver [1] fotos.,$ 462.00,$ 462.00,Ecatepec Palomas,55-5980-4931
215014284.1,AUDIFONOS (usado),POWERBEAT,A1747,"POWERBEAT A1747 ,  AURICULAR IN-EAR GAMER INALÁMBRICO APPLE BEATS POWERBEATS³ NEGRO CON LUZ LED",ver [1] fotos.,"$ 2,500.00","$ 2,500.00",Ecatepec Santa Clara,55-5980-4918
258021994.3,AUDIFONOS (usado),SM,SM,SM SM AUDÍFONOS DEPORTIVOS BLUETOOTH COLOR GRIS CON CABLE CARGADOR DETALLES POR USO,ver [1] fotos.,$ 917.00,$ 917.00,Ecatepec Santa Clara,55-5980-4918
258024969.1,AUDIFONOS (usado),OTRA MARCA,SM,"AUDIFONOS EN FUNDA OTRA MARCA(AVAYA) SM MINIMOS DETALLES DE USO , EN COLOR NEGRO CON ROJO.",ver [1] fotos.,$ 265.00,$ 265.00,Ecatepec Santa Clara,55-5980-4918
258025028.1,AUDIFONOS (usado),SONY,SM,"AUDIFONOS SIN CAJA SONY SM MINIMOS DETALLES DE USO , FUNCIONANDO ,EN COLOR NEGRO.",ver [1] fotos.,$ 661.00,$ 661.00,Ecatepec Santa Clara,55-5980-4918
61036364.2,AUDIFONOS (usado),LINKBITS,GAM09,"AUDIFONOS PARA JUEGO  ALAMBRICOS LINKBITS GAM09 COLOR NEGRO, CAJA",ver [1] fotos.,$ 150.00,$ 150.00,Ecatepec Santa Clara,55-5980-4918
61036364.3,AUDIFONOS (usado),OTRA MARCA,X10,"AUDIFONOS ALAMBRICOS PARA JUEEGO OTRA MARCA(STEREOHEADSET) X10 COLOR BLANCO, CAJA",ver [1] fotos.,$ 149.00,$ 149.00,Ecatepec Santa Clara,55-5980-4918
61036364.4,AUDIFONOS (usado),LINKBITS,GAM09,"AUDIFONOS PARA JUEGO ALAMBRICO LINKBITS GAM09 COLOR NEGRO, CAJA",ver [1] fotos.,$ 105.00,$ 105.00,Ecatepec Santa Clara,55-5980-4918
61036412.6,AUDIFONOS (usado),LINKBITS,CAM09,"AUDIFONOS DE DIADEMA LINKBITS CAM09 PARA JUEGOS, COLOR NEGRO, NUEVOS",ver [1] fotos.,$ 137.00,$ 137.00,Ecatepec Santa Clara,55-5980-4918
61036424.1,AUDIFONOS (usado),JABRA,PLANTRONICS,"JABRA PLANTRONICS CON CONEXIÓN USB, MICRÓFONO",ver [1] fotos.,$ 550.00,$ 550.00,Ecatepec Santa Clara,55-5980-4918
61036496.2,AUDIFONOS (usado),LINKBITS,GAM09,AUDIFONOS PARA JUEGO LINKBITS GAM09 COLOR NEGRO EN CAJA,ver [1] fotos.,$ 127.00,$ 127.00,Ecatepec Santa Clara,55-5980-4918
61036509.3,AUDIFONOS (usado),POLY,VOYAGERFOCUS2,"POLY VOYAGERFOCUS2 AURICULARES INALÁMBRICOS POLY VOYAGER FOCUS 2 UC STANDARD USB-A NEGRO , CAJA, CARGADOR, DETALLE DE USO",ver [1] fotos.,"$ 1,260.00","$ 1,260.00",Ecatepec Santa Clara,55-5980-4918
61036540.4,AUDIFONOS (usado),JABRA,BIZ1500,"AURICULARES ALÁMBRICO DIADEMA OFICINA/CENTRO DE LLAMADAS JABRA BIZ1500 COLOR NEGRO, DETALLES DE USO",ver [1] fotos.,$ 628.00,$ 628.00,Ecatepec Santa Clara,55-5980-4918
61036714.1,AUDIFONOS (usado),JABRA,EVOLVE240,"JABRA EVOLVE240 AURICULARES CON CABLE, USB-C, ESTÉREO, NEGRO, AURICULARES DE TELETRABAJO PARA LLAMADAS Y MÚSICA, COMODIDAD MEJORADA DURANTE TODO EL DÍA, AURICULARES CON CANCELACIÓN PASIVA",ver [1] fotos.,$ 964.00,$ 964.00,Ecatepec Santa Clara,55-5980-4918
61036734.4,AUDIFONOS (usado),LINKBITS,X10,AUDIFONOS ALAMBRICOS  DE DIADEMA LINKBITS X10 COLOR NEGRO ENCAJA,ver [1] fotos.,$ 188.00,$ 188.00,Ecatepec Santa Clara,55-5980-4918
61036738.3,AUDIFONOS (usado),JABRA,W13L,AUDIFONOS DE DIADEMA JABRA W13L COLOR NEGRO CON FUNDA Y CABLE,ver [1] fotos.,$ 919.00,$ 919.00,Ecatepec Santa Clara,55-5980-4918
61037158.1,AUDIFONOS (usado),APPLE,A1602,"APPLE A1602 APPLE AIRPODS SEGUNDA GENERACIÓN COLOR BLANCO , CON CABLE DETALLES DE USO",ver [1] fotos.,$ 700.00,$ 700.00,Ecatepec Santa Clara,55-5980-4918
61037158.3,AUDIFONOS (usado),APPLE,A1602,"APPLE A1602 AIRPODS 2A GENERACIÓN APPLE  COLOR BLANCO , CON CABLE DETALLES DE USO",ver [1] fotos.,$ 700.00,$ 700.00,Ecatepec Santa Clara,55-5980-4918
61037309.1,AUDIFONOS (usado),POLY,ENCOREPRO320,POLY ENCOREPRO320 PLANTRONICS POLY DUO C5220T CON CABLE CON CONTROL,ver [1] fotos.,$ 675.00,$ 675.00,Ecatepec Santa Clara,55-5980-4918
61037346.1,AUDIFONOS (usado),OTRA MARCA,X10,"AUDIFONOS OTRA MARCA(STEREOHEADSET) X10 COLOR BLANCO, NUEVO",ver [1] fotos.,$ 147.00,$ 147.00,Ecatepec Santa Clara,55-5980-4918
61037346.2,AUDIFONOS (usado),OTRA MARCA,X10,"AUDIFONOS OTRA MARCA(STEREOHEADSET) X10 M  COLOR BLANCO, NUEVO",ver [1] fotos.,$ 159.00,$ 159.00,Ecatepec Santa Clara,55-5980-4918
61037797.1,AUDIFONOS (usado),JABRA,HSC016,JABRA HSC016 AURICULARES ALÁMBRICO DIADEMA OFICINA/CENTRO DE LLAMADAS USB TIPO A NEGRO,ver [1] fotos.,$ 450.00,$ 450.00,Ecatepec Santa Clara,55-5980-4918
61037814.1,AUDIFONOS (usado),APPLE,A2931,APPLE A2931 AUDÍFONOS INALÁMBRICOS A2931 COMPATIBLE IPHONE ANDROID. CON CAJA  CON DETALLES DE USO,ver [1] fotos.,$ 343.00,$ 343.00,Ecatepec Santa Clara,55-5980-4918
61037980.1,AUDIFONOS (usado),SM,SM,AUDÍFONOS ALÁMBRICOS DIADEMA SM SM COLOR NEGRO CON CABLES DETALLES DE USO,ver [1] fotos.,$ 187.00,$ 187.00,Ecatepec Santa Clara,55-5980-4918
61038063.4,AUDIFONOS (usado),HUAWEI,FREEBUDSLITE,HUAWEI FREEBUDSLITE AUFOINOS EN CAJA  CON CABLE DETALLES DE USO,ver [1] fotos.,$ 800.00,$ 800.00,Ecatepec Santa Clara,55-5980-4918
61038063.5,AUDIFONOS (usado),PANASONIC,RBHF520B,PANASONIC RBHF520B AUDIFONOS INALAMBRICOSDETALLDE DE USO,ver [1] fotos.,$ 327.00,$ 327.00,Ecatepec Santa Clara,55-5980-4918
61038116.2,AUDIFONOS (usado),KLIPXTREME,FURY,"AUDIFONOS DIADEMA ------- KLIPXTREME FURY COLOR AZUL, CAJA, CABLE",ver [1] fotos.,$ 139.00,$ 139.00,Ecatepec Santa Clara,55-5980-4918
61038116.3,AUDIFONOS (usado),BELKIN,AUD002,AUDIFONOS NIÑA ROSA BELKIN AUD002 DETALLES DE USO,ver [1] fotos.,$ 159.00,$ 159.00,Ecatepec Santa Clara,55-5980-4918
61038118.2,AUDIFONOS (usado),KLIPXTREME,UMBRA,"AUDIFONOS DIADEMA KLIPXTREME UMBRA COLOR NEGRO, CAJA, CABLE, BUEN ESTADO",ver [1] fotos.,$ 320.00,$ 320.00,Ecatepec Santa Clara,55-5980-4918
61038251.1,AUDIFONOS (usado),IKEA,IKFT3,AUDIFONOS DE DIADEMAS IKEA IKFT3 COLOR BLANCO EN CAJA,ver [1] fotos.,$ 624.00,$ 624.00,Ecatepec Santa Clara,55-5980-4918
61038251.2,AUDIFONOS (usado),TOZO,T10,AUDIFONOS INALAMBRICOS TOZO T10 COLOR NEGRO EN ESTUCHE CON CAJA,ver [1] fotos.,$ 328.00,$ 328.00,Ecatepec Santa Clara,55-5980-4918
61038264.1,AUDIFONOS (usado),SHOKZ,S820,"SHOKZ S820 AURICULARES BLUETOOTH SHOKZ SPORTS OPENRUN PRO2 S820 COLO COLOR NEGRO, CAJA, ESTCUHE, CABLE, BUEN ESTADO",ver [1] fotos.,"$ 1,400.00","$ 1,400.00",Ecatepec Santa Clara,55-5980-4918
61038500.2,AUDIFONOS (usado),HUAWEI,WALCT026,"FREEBUDS 3I HUAWEI WALCT026 COLOR NEGRO, CABLE, CAJA, DETALLE DE USO",ver [1] fotos.,$ 501.00,$ 501.00,Ecatepec Santa Clara,55-5980-4918
61038514.1,AUDIFONOS (usado),LINKBITS,GAM10,AUDIFONOS PARA JUEGO LINKBITS GAM10 COLOR NEGRO EN CAJA,ver [1] fotos.,$ 197.00,$ 197.00,Ecatepec Santa Clara,55-5980-4918
61038514.2,AUDIFONOS (usado),OTRA MARCA,X10,AUDIFONOS DE GAMER OTRA MARCA(STEREOHEADSET) X10 COLOR NEGRO EN CAJA,ver [1] fotos.,$ 204.00,$ 204.00,Ecatepec Santa Clara,55-5980-4918
61038514.3,AUDIFONOS (usado),OTRA MARCA,X10,AUDIFONOS DE GAMER OTRA MARCA(STEREOHEADSET) X10 COLOR NEGRO EN CAJA,ver [1] fotos.,$ 204.00,$ 204.00,Ecatepec Santa Clara,55-5980-4918
61038794.1,AUDIFONOS (usado),HONOR,ROSME01,"AUDIFONOS HONOR ROSME01 COLOR NEGRO, CAJA, CABLES, BUEN ESTADO",ver [1] fotos.,$ 550.00,$ 550.00,Ecatepec Santa Clara,55-5980-4918
61038795.1,AUDIFONOS (usado),SENNHEISER,1338,SENNHEISER 1338 AURICULARES ESTÉREO,ver [1] fotos.,$ 487.00,$ 487.00,Ecatepec Santa Clara,55-5980-4918
61038846.2,AUDIFONOS (usado),SONY,SM,AUDÍFONOS DE DIADEMA SONY SM COLOR NEGRO DETALLES DE USO,ver [1] fotos.,$ 115.00,$ 115.00,Ecatepec Santa Clara,55-5980-4918
61038879.1,AUDIFONOS (usado),OPPO,ENCOAIR4PRO,OPPO ENCOAIR4PRO EARPODS OPPO ENCO AIR 4 PRO COLOR NEGRO CON CAJA EN BUENAS CONDICIONES,ver [1] fotos.,"$ 1,483.00","$ 1,483.00",Ecatepec Santa Clara,55-5980-4918
61038880.1,AUDIFONOS (usado),SONY,WFC510,SONY WFC510 EARPODS SONY COLOR NEGRO CON CAJA EN BUEN ESTADO SIN CABLE DE CARGA,ver [1] fotos.,$ 572.00,$ 572.00,Ecatepec Santa Clara,55-5980-4918
61038901.1,AUDIFONOS (usado),BILLBOARD,BBE78589,BILLBOARD BBE78589 AUDIFONOS EN CAJA CON ESTUCHE DETALLES DE USO,ver [1] fotos,$ 406.00,$ 406.00,Ecatepec Santa Clara,55-5980-4918
61039168.2,AUDIFONOS (usado),MICROSOFT,1564,MICROSOFT 1564 AURICULARES DE CHAT CON CABLE MICROSOFT,ver [1] fotos.,$ 278.00,$ 278.00,Ecatepec Santa Clara,55-5980-4918
61039168.3,AUDIFONOS (usado),MICROSOFT,1564,MICROSOFT 1564 AURICULARES DE CHAT CON CABLE MICROSOFT,ver [1] fotos.,$ 278.00,$ 278.00,Ecatepec Santa Clara,55-5980-4918
61039346.5,AUDIFONOS (usado),APPLE,A2883,AUDIFONOS APPLE A2883 COLOR BANCO CON ESTUCHE /CAJA SIN CARGADOR,ver [1] fotos.,$ 626.00,$ 626.00,Ecatepec Santa Clara,55-5980-4918
61039346.6,AUDIFONOS (usado),TCL,TW20,AUDIFONO TCL TW20 COLOR NEGRO CON CAJA CABLE,ver [1] fotos,$ 308.00,$ 308.00,Ecatepec Santa Clara,55-5980-4918
61039396.1,AUDIFONOS (usado),OTRA MARCA,MERIDIAN,AUDIFONOS INALAMBRICO OTRA MARCA(TONE) MERIDIAN COLOR BLANCO CON CABLE DETALLES DE USO,ver [1] fotos,$ 918.00,$ 918.00,Ecatepec Santa Clara,55-5980-4918
61039396.2,AUDIFONOS (usado),OTRA MARCA,MERIDIAN,AUDIFONOS OTRA MARCA(TONE) MERIDIAN COLOR BLANCO CON CABLE DETALLES DE USO,ver [1] fotos,$ 918.00,$ 918.00,Ecatepec Santa Clara,55-5980-4918
61039396.3,AUDIFONOS (usado),SONY,NWWS413,REPRODUCTOR INALAMBRICO SONY NWWS413 COLOR NEGRA CON CARGADOR,ver [1] fotos.,"$ 1,258.00","$ 1,258.00",Ecatepec Santa Clara,55-5980-4918
61039409.1,AUDIFONOS (usado),HONOR,EARBUDSX7I,AUDIFONOS HONOR EARBUDSX7I COLOR BLANCOS CON CAJA FUNCIONANDO BIEN,ver [1] fotos.,$ 322.00,$ 322.00,Ecatepec Santa Clara,55-5980-4918
61039412.5,AUDIFONOS (usado),MOTOROLA,MOTOBUDS085,"MOTOROLA MOTOBUDS085 MOTOROLA SOUND - AUDIFONOS MOTOBUDS085, INALAMBRICOS, COMPATIBLES CON ANDROID Y IOS, BLUETOOTH 5.1, COLOR NEGRO CON DETALLE SDE USO",ver [1] fotos,$ 426.00,$ 426.00,Ecatepec Santa Clara,55-5980-4918
61039412.6,AUDIFONOS (usado),SKULLCANDY,AH2148,SKULLCANDY AH2148 AUDÍFONOS IN-EAR PUSH ACTIVE INALÁMBRICOS CON DETALLES DE USO,ver [1] fotos,$ 924.00,$ 924.00,Ecatepec Santa Clara,55-5980-4918
61039412.7,AUDIFONOS (usado),APPLE,A1602,APPLE A1602 APPLE AIRPODS SEGUNDA GENERACIÓN ESTUCHE CARGA SELLADOS COLOR BLANCO CON DETALLES DE USO,ver [1] fotos.,"$ 1,143.00","$ 1,143.00",Ecatepec Santa Clara,55-5980-4918
61039486.1,AUDIFONOS (usado),SMA,SM,AUDIFONOS SMA SM COLOR BLANCO CON CABLE DE CORRIENTE,ver [1] fotos,$ 99.00,$ 99.00,Ecatepec Santa Clara,55-5980-4918
61039486.2,AUDIFONOS (usado),SMA,SM,AUDIFONOS SMA SM COLOR NEGRO CON CABLE DE CORRIENTE,ver [1] fotos,$ 99.00,$ 99.00,Ecatepec Santa Clara,55-5980-4918
8129350.1,AUDIFONOS (usado),APPLE,A1602,AIRPODS MARCA APPLE A1602 DETALLES DE USO CON CABLE DE CARGA,ver [1] fotos.,$ 588.00,$ 588.00,Galerías Chalco,55-4160-5686
8129674.1,AUDIFONOS (usado),ATVIO,20MX06EP3,AUDIFONOS ATVIO 20MX06EP3 IN EAR CON GANCHO ALAMBRICOS EN CAJA SIN USO,ver [1] fotos.,$ 51.00,$ 51.00,Galerías Chalco,55-4160-5686
8129674.2,AUDIFONOS (usado),ATVIO,20MX06EP3,AUDIFONOS ATVIO 20MX06EP3 IN EAR CON GANCHOS ALAMBRICOS EN CAJA SIN USO,ver [1] fotos.,$ 48.00,$ 48.00,Galerías Chalco,55-4160-5686
8131404.1,AUDIFONOS (usado),APPLE,A1602,AUDIFONOS APPLE A1602 / COLOR BLANCO/ SIN CARGADOR/ AUDIFONOS CARGADOS/ CARGADOR CON LED DENTRO,ver [1] fotos.,$ 837.00,$ 837.00,Galerías Chalco,55-4160-5686
8131603.2,AUDIFONOS (usado),HUAWEI,T0014,AUDIFONOS / HUAWEI T0014 / COLOR NEGRO/ CAJA CARGADOR CON IMAN/ SIN CARGADOR/ RAY MLAT POR DETALLES DE USO,ver [1] fotos.,$ 481.00,$ 481.00,Galerías Chalco,55-4160-5686
8131722.2,AUDIFONOS (usado),LG,HBSFL7,AUDIFONOS BLUETOOTH / LG HBSFL7 / NEGROS/ CARGADOR/ RAY MALT PORDETALLES DE USO,ver [1] fotos.,$ 618.00,$ 618.00,Galerías Chalco,55-4160-5686
8131976.1,AUDIFONOS (usado),APPLE,A1602,APPLE AIRPODS SEGUNDA GENERACIÓN ESTUCHE CARGA / SIN CARGADOR/ RAY MALT PORDETALLES DE USO / APPLE A1602,ver [1] fotos.,$ 810.00,$ 810.00,Galerías Chalco,55-4160-5686
8132313.1,AUDIFONOS (usado),MOTOROLA,XT24431,AUDIFONOS MOTOROLA XT24431 BUDS COLOR BLANCO/ AZUL SIN CABLE RAY/MLATR POR USO,ver [1] fotos.,$ 545.00,$ 545.00,Galerías Chalco,55-4160-5686
8132363.3,AUDIFONOS (usado),1HORA,AUT206,1HORA AUT206 //////AUDIFONOS BT COLOR NEGRO/CABLE DE CARGA TIPO C/CAJA DE CARGA/DETALLES D EUSO-_-,ver [1] fotos.,$ 196.00,$ 196.00,Galerías Chalco,55-4160-5686
8132545.1,AUDIFONOS (usado),APPLE,A1602,APPLE AIRPODS CON ESTUCHE DE CARGA LIGHTNING / CON CABLE DE CARGA/ RAY MAOLT POR DETALLESDE USO / APPLE A1602,ver [1] fotos.,$ 950.00,$ 950.00,Galerías Chalco,55-4160-5686
8132843.1,AUDIFONOS (usado),JBL,TUNEFLEX,AUDÍFONOS INALÁMBRICOS JBL TUNE FLEX BLUETOOTH  / RAY MALT POR DETALLESDEUSO / JBL TUNEFLEX,ver [1] fotos.,$ 600.00,$ 600.00,Galerías Chalco,55-4160-5686
8132896.1,AUDIFONOS (usado),OPPO,ETE42,OPPO ETE42 /////AUDIFONOS BT COLOR VERDE///ESTUCHE DE CARGA COLOR VERDE/CABLE TIPO C NEGRO/BOTON TACTIL EN AUDIFONOS/DETALLES DE USO-_-,ver [1] fotos.,$ 300.00,$ 300.00,Galerías Chalco,55-4160-5686
8132985.1,AUDIFONOS (usado),YAMAHA,TWE5B,YAMAHA TWE5B ////AUDIFONOS BT/CAJA DE CARGA COLOR GRIS/CABLE DE CARGA TIPO C COLOR NEGRO/EN CAJA/DETALLES DE USO-_-,ver [1] fotos.,"$ 1,000.00","$ 1,000.00",Galerías Chalco,55-4160-5686
8133029.1,AUDIFONOS (usado),HUAWEI,T0016,HUAWEI T0016 ////AUDIFONOS COLOR BLANCO/CABLE TIPO C/EN CAJA/DETALLES DE USO-_-,ver [1] fotos.,$ 545.00,$ 545.00,Galerías Chalco,55-4160-5686
8133036.2,AUDIFONOS (usado),SM,SM,AUDIFONOS TIPO DIADEMA COLOR ROJO CON CABLE DE CARGA BLANCO | SIN MODELO NI MARCA | TRAY MALT POR DETALLESDEUSO | SM SM,ver [1] fotos.,$ 170.00,$ 170.00,Galerías Chalco,55-4160-5686
8133072.1,AUDIFONOS (usado),BEAST,SM,AUDÍFONOS STF BEAST  GAMING PARA PC | COLOR NEGRO | RAY MALT POR DETALLES DE USO | BEAST SM,ver [1] fotos.,$ 420.00,$ 420.00,Galerías Chalco,55-4160-5686
8133072.2,AUDIFONOS (usado),SAMURAI,SM,AUDÍFONOS GAMER  CON AUDIFONOS COLOR BLANCO RAY MALT POR DETALLES  DE USO SAMURAI SM,ver [1] fotos.,$ 400.00,$ 400.00,Galerías Chalco,55-4160-5686
8133114.1,AUDIFONOS (usado),APPLE,A1602,APPLE AIRPODS SEGUNDA GENERACIÓN ESTUCHE CARGA | Y CABLE APPLE A1602,ver [1] fotos.,$ 810.00,$ 810.00,Galerías Chalco,55-4160-5686
8133126.1,AUDIFONOS (usado),SONY,WH1000MX4,SONY WH1000MX4 ////AUDIFONOS INALAMBRICOS COLOR NEGRO/(FOMA DIADEMA)/EN ESTUCHE Y CAJA/FALTA CABLE DE CARGA TIPO C/DETALLES DE USO-_-,ver [1] fotos.,"$ 2,381.00","$ 2,381.00",Galerías Chalco,55-4160-5686
8133137.1,AUDIFONOS (usado),HUAWEI,T0016L,AUDIFONOS BT HUAWEI T0016L ///////CARGADOR TIPO C COLOR BLANCO GEN/ESTUCHE DE CARGA/BOTONES TACTILES EN COSTADOS/DETALLES DE USO-_-,ver [1] fotos.,$ 472.00,$ 472.00,Galerías Chalco,55-4160-5686
8133167.1,AUDIFONOS (usado),BOSE,441408,BOSE 441408 ////AUDIFONOS BT/ESTUCHE DE CARHA CON ENTRADA TIPO C/AURICULARES COLOR NEGRO CON GRIS/DETALLES DE USO-_-+,ver [1] fotos.,"$ 2,095.00","$ 2,095.00",Galerías Chalco,55-4160-5686
8133211.1,AUDIFONOS (usado),APPLE,A2564,AIRPODS IMITACION  DE 3RA GEENERACION | CON ABERTURA EN CAJA DE CARGA | APPLE A2564 | CABLE TIPO C  | RAY MALT POR DETALLES DE USO,ver [1] fotos.,$ 650.00,$ 650.00,Galerías Chalco,55-4160-5686
8133343.1,AUDIFONOS (usado),CHEVROLET,AUDIFONOS,AUDIFONOS CHEVROLET EN CAJA / SIN CABLE PARA CARGAR  / CHEVROLET AUDIFONOS / RAY MALT POR DETALLES DE USO,ver [1] fotos.,"$ 1,948.00","$ 1,948.00",Galerías Chalco,55-4160-5686
8133482.17,AUDIFONOS (usado),AUDIFONO EN CAJA MISIK,---,$ 69.00,$ 69.00,Galerías Chalco,55-4160-5686
8133482.19,AUDIFONOS (usado),AUDIFONO EN CAJA MISIK,---,$ 69.00,$ 69.00,Galerías Chalco,55-4160-5686
8133928.1,AUDIFONOS (usado),STF,ICON,AUDIFONOS DE DIADEMA COLOR NEGRO EN CAJA CON CABLE DE CARGA Y CABLE AUXILIAR STF ICON EN BUEN ESTADO,ver [1] fotos.,$ 425.00,$ 425.00,Galerías Chalco,55-4160-5686
8134091.1,AUDIFONOS (usado),SONY,BCRNWWS610,SONY BCRNWWS610,ver [1] fotos.,"$ 1,067.00","$ 1,067.00",Galerías Chalco,55-4160-5686
8134102.1,AUDIFONOS (usado),APPLE,A2190,AIRPODS PRO 1ERA CLONES - APPLE COLOR BLANCO  + FUNDA +  CABLE  DE CARGA / APPLE A2190 / RAY MALT POR DETALLES DE USO,ver [1] fotos.,$ 277.00,$ 277.00,Galerías Chalco,55-4160-5686
8134141.2,AUDIFONOS (usado),SAMSUNG,SMR510,SAMSUNG SMR510 AUDIFONOS BLUETOOTH SAMSUNG COLOR NEGRO RAY/MALT POR DETALLES DE USO,ver [1] fotos.,$ 938.00,$ 938.00,Galerías Chalco,55-4160-5686
70018043.1,AUDIFONOS (usado),JBL,RT0017,AUDIFONOS JBL RT0017 VIBE BUDS COLOR GRIS CON CARGADOR DE ENERGIA GENERICO,ver [1] fotos.,$ 563.00,$ 563.00,Gran Patio Ecatepec,55-4160-5740
72025338.5,AUDIFONOS (usado),REDMI,M2222E1,AUDIFONOS INALÁMBRICOS REDMI M2222E1 NEGRO CABLE DE CARGA RAYT//MALT POR DETALLES FDE USO,ver [1] fotos.,$ 499.00,$ 499.00,Gran Patio Valle de Chalco,55-4160-5744
72026015.1,AUDIFONOS (usado),GEARTEK,H1GR,"GEARTEK H1GR /AUDIFONOS ALAMBRICOS CON MICROFONO,EN CAJA,DETALLES DE USO",ver [1] fotos.,$ 301.00,$ 301.00,Gran Patio Valle de Chalco,55-4160-5744
72026198.1,AUDIFONOS (usado),MOTOROLA,XT24431,MOTOROLA XT24431 // AUDIFONOS // MOTOROLA // COLOR NARANJA // EN CAJA // SIN CABLE // DETALLES DE USO,ver [1] fotos.,$ 621.00,$ 621.00,Gran Patio Valle de Chalco,55-4160-5744
72026291.1,AUDIFONOS (usado),REDMI,BUDS3PRO,"AUDIFONOS REDMI BUDS3PRO COLOR NEGRO,CABLE,GOMITAS DE REPUESTO,EN CAJA,DET DE USO",ver [1] fotos.,$ 973.00,$ 973.00,Gran Patio Valle de Chalco,55-4160-5744
72026480.1,AUDIFONOS (usado),MOTOROLA,XT24431,"AUDIFONOS MOTOROLA XT24431 COLOR BLANCO,ACCESORIOS DET DE USO",ver [1] fotos.,$ 644.00,$ 644.00,Gran Patio Valle de Chalco,55-4160-5744
72026486.1,AUDIFONOS (usado),HONOR,ROSME01,"HONOR ROSME01 /AUDIFONOS HONOR CHOICE VZ SPORT,CAJA,CABLE DE CARGA DETALLES DE USO",ver [1] fotos.,$ 957.00,$ 957.00,Gran Patio Valle de Chalco,55-4160-5744
72026847.2,AUDIFONOS (usado),TURTLEBEACH,RECON50X,"TURTLEBEACH RECON50X /AUDÍFONOS TURTLE BEACH ALÁMBRICOS RECON 50X,DETALLES POR USO",ver [1] fotos,$ 347.00,$ 347.00,Gran Patio Valle de Chalco,55-4160-5744
72026849.1,AUDIFONOS (usado),OTRA MARCA,HER9,AUDIFONOS OTRA MARCA(HIFIMAN) HER9 COLOR ROJO//CABLE //EN CAJA//EN BUEN ESTADO,ver [1] fotos,"$ 1,686.00","$ 1,686.00",Gran Patio Valle de Chalco,55-4160-5744
8133482.126,AUDIFONOS (usado),AUDIFONO EN CAJA MISIK,---,$ 61.00,$ 61.00,Gran Patio Valle de Chalco,55-4160-5744
8133482.127,AUDIFONOS (usado),AUDIFONO EN CAJA MISIK,---,$ 61.00,$ 61.00,Gran Patio Valle de Chalco,55-4160-5744
8133482.128,AUDIFONOS (usado),AUDIFONO EN CAJA MISIK,---,$ 61.00,$ 61.00,Gran Patio Valle de Chalco,55-4160-5744
8133482.129,AUDIFONOS (usado),AUDIFONO EN CAJA MISIK,---,$ 61.00,$ 61.00,Gran Patio Valle de Chalco,55-4160-5744
1129881.1,AUDIFONOS (usado),SAMSUNG,SMR140,SAMSUNG SMR140 /SAMSUNG EARBUDS/SIN CAJA SIN CARGADOS//DETALLES DE USO RAY/MALT,ver [1] fotos.,$ 923.00,$ 923.00,Héroes Chalco,55-8880-1489
1132822.2,AUDIFONOS (usado),HAING,HIA61DCH,"HAING HIA61DCH BUENAS CONDICIONES, EN CAJA, COLOR ROSA CON BLANCO",ver [1] fotos.,$ 256.00,$ 256.00,Héroes Chalco,55-8880-1489
286006829.1,AUDIFONOS (usado),HONOR,ORLME00,HONOR ORLME00 AUDIFONOS HONOR COLOR GRIS CON CAJA,ver [1] fotos.,$ 637.00,$ 637.00,Héroes Chalco,55-8880-1489
286006874.1,AUDIFONOS (usado),APPLE,A2032,APPLE A2032 AIRPODS 2 / CABLE USB CON CAJA  MINIMOS DETALLES DE USO,ver [1] fotos.,$ 499.00,$ 499.00,Héroes Chalco,55-8880-1489
286006902.1,AUDIFONOS (usado),SKULLCANDY,S6CAWS951,AUDIFONOS DE DIADEMA SKULLCANDY S6CAWS951 COLOR BLANCO EN CAJA CON BOLSA  CABLE CARGADOR Y AUXILIAR DETALLES DE USO,ver [1] fotos.,"$ 1,684.00","$ 1,684.00",Héroes Chalco,55-8880-1489
286007177.1,AUDIFONOS (usado),APPLE,A1602,"AUDIFONOS APPLE A1602 / AIRPODS DEGUSNDA GENERACION /SIN CABLE /SIN CAJA ,CON EASTUCHE DE SILICON COLOR NEGRO MATE",ver [1] fotos.,$ 810.00,$ 810.00,Héroes Chalco,55-8880-1489
5139545.1,AUDIFONOS (usado),LOGITECH,H570E,LOGITECH H570E AUDIFONOS PARA PC LONGITECH/CAJA/DETALLES DE USO/RAY MALTR,ver [1] fotos.,$ 346.00,$ 346.00,Héroes Chalco,55-8880-1489
1127072.1,AUDIFONOS (usado),STF,POLUX25TRUEWIRELESS,AUDIFONOS STF POLUX25TRUEWIRELESS //LOTE  DE 3  AUDIFONOS STF COLOR ROSA Y BLANCO // EN PAQUETE,ver [1] fotos.,$ 378.00,$ 378.00,Héroes Ixtapaluca,55-4160-5674
1127135.1,AUDIFONOS (usado),STF,POLUX25TRUEWIRELESS,LOTE DE 6 AUDIFONOS STF POLUX25TRUEWIRELESS // LOTE DE AUDIFONOS STF// VARIOS COLORES ROSA// NEGRO Y BLANCO// EN EMPAQUE NUEVOS,ver [1] fotos.,$ 768.00,$ 768.00,Héroes Ixtapaluca,55-4160-5674
