Prenda / Sku Lote,Familia,Marca,Modelo,Descripción,Imagenes,Precio Venta,Precio Promoción,Tienda,Tel. Tienda
40042361.1,AUDIFONOS (usado),BOSE,SM,BOSE SM AUDIFONOS INALAMBRICOS BOSE COLOR NEGRO DETALLES DE USO,ver [1] fotos.,$ 905.00,$ 905.00,Atizapán Plaza Cristal,55-4160-5890
40046009.1,AUDIFONOS (usado),BEATS,FLEX,BEATS FLEX AURICULARES NEGROS MALTRATADOS MARCAS DE USO EN CAJA,ver [1] fotos.,$ 679.00,$ 679.00,Atizapán Plaza Cristal,55-4160-5890
40047093.1,AUDIFONOS (usado),OTRA MARCA,BOWERSWILKINGP17,AUDIFONOS BOWERS WIKINS OTRA MARCA(BOWERSWILKINS) BOWERSWILKINGP17 AUDIFONOS EN CAJA SUCIO DETALLES DE USOS,ver [1] fotos.,"$ 2,300.00","$ 2,300.00",Atizapán Plaza Cristal,55-4160-5890
40047315.5,AUDIFONOS (usado),SM,AUDIFONOSU60,SM AUDIFONOSU60 AUDIFONOS TWS EN CAJA SE ABRE PARA PROBAR SU FUNCIONAMIENTO,ver [1] fotos.,$ 166.00,$ 166.00,Atizapán Plaza Cristal,55-4160-5890
40047315.9,AUDIFONOS (usado),TWS,U60,TWS U60 AUDIFONOS TWS EN CAJA SE ABRE PARA PROBAR SU FUNCIONAMIENTO,ver [1] fotos.,$ 178.00,$ 178.00,Atizapán Plaza Cristal,55-4160-5890
40047389.1,AUDIFONOS (usado),HUAWEI,T0013C,HUAWEI T0013C AUDIFONOS INALAMBRICOS COLOR ORANGE/MARCVAS DE USO TIPO MUESCAS EN EL ESTUCHE/EN CAJA/CON CABLE DE CARGA,ver [1] fotos.,"$ 1,130.00","$ 1,130.00",Atizapán Plaza Cristal,55-4160-5890
41065175.1,AUDIFONOS (usado),APPLE,A2700,APPLE A2700 AIRPODS PRO 2DA GENERACION COLOR BLANCO,ver [1] fotos.,"$ 1,200.00","$ 1,200.00",Azcapotzalco,55-4160-5775
41065214.2,AUDIFONOS (usado),HONOR,EARBUDSX71,HONOR EARBUDSX71 AUDIFONOS BLUETOOTH EN CAJA,ver [1] fotos.,$ 400.00,$ 400.00,Azcapotzalco,55-4160-5775
41065558.1,AUDIFONOS (usado),APPLE,A2618,APPLE A2618 AIRPODSPRO 2 CLONES,ver [1] fotos.,$ 200.00,$ 200.00,Azcapotzalco,55-4160-5775
41066003.1,AUDIFONOS (usado),JBL,520BT,JBL 520BT AUDIFONOS BLUIETOOTH COLOR AZUL SIN CABLE,ver [1] fotos.,$ 392.00,$ 392.00,Azcapotzalco,55-4160-5775
41066297.1,AUDIFONOS (usado),TURTLEBEACH,A6230,TURTLEBEACH A6230 AUDIFONOS DE DIADEMA TURTLE BEACH COLOR GRIS CON BLANCO BUENE STADO,ver [1] fotos.,$ 264.00,$ 264.00,Azcapotzalco,55-4160-5775
41066564.1,AUDIFONOS (usado),APPLE,A2566,APPLE A2566 AIRPODS APPLE 3RA GEN EN CAJA,ver [1] fotos.,"$ 1,176.00","$ 1,176.00",Azcapotzalco,55-4160-5775
77005093.1,AUDIFONOS (usado),APPLE,A2566,AUDIFONOS CON CABLE CARGADOR APPLE A2566 ARTICULO USADO SE REALIZAN PRUEBAS DE FUNCIONAMEINTO,ver [1] fotos.,$ 735.00,$ 735.00,Cancún MultiPlaza Arco Norte,998-777-0397
77005249.1,AUDIFONOS (usado),APPLE,A2700,"AIRPODS SEGUNDA GENERACION, APPLE A2700 ,CARGADOR,USADO",ver [1] fotos.,$ 921.00,$ 921.00,Cancún MultiPlaza Arco Norte,998-777-0397
77005378.1,AUDIFONOS (usado),MONTBLANC,MTB03,"AUDIFONON INHALAMBRICOS BLUETOOTH MONTBLANC MTB03 ,NEGROS,CARGADOR,USADO",ver [1] fotos.,"$ 2,230.00","$ 2,230.00",Cancún MultiPlaza Arco Norte,998-777-0397
77005645.1,AUDIFONOS (usado),APPLE,A2190,"AIRPODS 1RE GENERACION COLOR BLANCO, APPLE A2190 , CON CABLE DE CARGADOR SIN CUBO, DETALLES DE USO.",ver [1] fotos.,$ 799.00,$ 799.00,Cancún MultiPlaza Arco Norte,998-777-0397
77005657.1,AUDIFONOS (usado),SM,IP54,SM IP54 AUDIFONOS INALAMBRICOS BOWERS & WILKINS PI5 IN-EAR TWS - NEGRO BOWERS & WILKINS PI5,ver [1] fotos.,"$ 1,807.00","$ 1,807.00",Cancún MultiPlaza Arco Norte,998-777-0397
77005817.1,AUDIFONOS (usado),APPLE,A1602,"AIRPODS 2DA GENERACION, COLOR BLCO. APPLE A1602 , CON CABLE USB, USADO.",ver [1] fotos.,$ 521.00,$ 521.00,Cancún MultiPlaza Arco Norte,998-777-0397
77005908.1,AUDIFONOS (usado),APPLE,A2190,"AURICULARES AIRPODS, COLOR BLANCO, APPLE A2190 , CON CABLE USB Y CUBO, USADO.",ver [1] fotos.,"$ 1,015.00","$ 1,015.00",Cancún MultiPlaza Arco Norte,998-777-0397
77006044.1,AUDIFONOS (usado),LG,TONET60Q,"AUDIFONOS INALAMBRICOS, COLOR NEGRO, LG TONET60Q , CON CABLE USB, USADO.",ver [1] fotos.,$ 654.00,$ 654.00,Cancún MultiPlaza Arco Norte,998-777-0397
77006503.1,AUDIFONOS (usado),BEATS,A2454,"AUDIFONOS INALAMBRICOS , COLOR ROJO , BEATS A2454 , CON CABLE DE USB, USADOS",ver [1] fotos.,"$ 1,100.00","$ 1,100.00",Cancún MultiPlaza Arco Norte,998-777-0397
77006713.1,AUDIFONOS (usado),APPLE,A1602,"AIRPODS SEGUNDA GENERACION, COLOR BLCO. APPLE A1602 , CON CABLE USB Y CUBO, USADO.",ver [1] fotos.,$ 800.00,$ 800.00,Cancún MultiPlaza Arco Norte,998-777-0397
77007175.1,AUDIFONOS (usado),SAMSUNG,SMR180,"AUDÍFONOS INALÁMBRICOS GALAXY BUDS LIVE NEGRO COLOR NEGRO, SAMSUNG SMR180 , CON CABLE DE USB SIN CUBO, USADO",ver [1] fotos.,$ 900.00,$ 900.00,Cancún MultiPlaza Arco Norte,998-777-0397
77007523.1,AUDIFONOS (usado),APPLE,A3059,"AIRPODS 4 GENERACION, COLOR BLCO. CON CANCELACION DE RUIDO, APPLE A3059 , CON CABLE USB, USADO.",ver [1] fotos.,"$ 2,000.00","$ 2,000.00",Cancún MultiPlaza Arco Norte,998-777-0397
77007653.2,AUDIFONOS (usado),SAMSUNG,BUDS2,SAMSUNG BUDS2,ver [1] fotos.,$ 729.00,$ 729.00,Cancún MultiPlaza Arco Norte,998-777-0397
77007721.1,AUDIFONOS (usado),MARSHALL,MAJORII,"AUDIFONOS ALAMBRICOS COLOR NEGRO, MARSHALL MAJORII , CON MANUALES, CON CABLE P/CELULAR, EN CAJA, USADO.",ver [1] fotos.,$ 906.00,$ 906.00,Cancún MultiPlaza Arco Norte,998-777-0397
77007753.1,AUDIFONOS (usado),APPLE,A2566,"AIRPODS 3RA GENERACION, COLOR BLCO. APPLE A2566 , CON CABLE USB Y CUBO, USADO.",ver [1] fotos.,"$ 1,726.00","$ 1,726.00",Cancún MultiPlaza Arco Norte,998-777-0397
77007839.1,AUDIFONOS (usado),HONOR,ORLME00,"AUDIFONOS HEADPHONES,COLOR NEGRO, EAR-BUDS OPEN-EAR, HONOR ORLME00 , CON CABLE USB, EN CAJA, USADO.",ver [1] fotos,$ 882.00,$ 882.00,Cancún MultiPlaza Arco Norte,998-777-0397
207010248.1,AUDIFONOS (usado),APPLE,A2190,AUDIFONOS AIRPODS APPLE A2190 COLOR BLANCO,ver [1] fotos.,"$ 1,010.00","$ 1,010.00",Chalco Centro,55-4160-5839
25090614.1,AUDIFONOS (usado),JBL,ENDURANCEJUMP,"AUDIFONOS INALAMBRICOS JBL ENDURANCEJUMP ----PLASTICO ROJO CON NEGRO,EN CAJA CON FUNDA DE SILICON GRIS,CABLE TIPOC,Y PAR DE GOMITAS PARA AURICULAR,ARTICULO EN BUEN ESTADO",ver [1] fotos.,$ 732.00,$ 732.00,Chalco Centro,55-4160-5839
25093170.1,AUDIFONOS (usado),HONOR,ORLME00,"AUDÍFONOS HONOR ORLME00 IFONOS BLUETOOTH HEADPHONES HONOR CHOICE OPEN-EAR TRUE WIRELESS EARBUDS OR BT , COLOR GRIS , CABLE USB , DETALLES DE USO SERIE 5504ABQY24821310",ver [1] fotos.,$ 569.00,$ 569.00,Chalco Centro,55-4160-5839
25093400.1,AUDIFONOS (usado),BOSE,QC3,AUDIFONOS BOSE QC3 EN ESTUCHE CON ACCESORIOS RAY MELT POR USO,ver [1] fotos.,"$ 1,199.00","$ 1,199.00",Chalco Centro,55-4160-5839
25093463.1,AUDIFONOS (usado),TCL,TW10,AUDIFONOS TCL TW10 AUDINOS CON CABLE USB Y ESTUCHE RECARGABLE / DETALLES DE USO,ver [1] fotos.,$ 342.00,$ 342.00,Chalco Centro,55-4160-5839
25093701.1,AUDIFONOS (usado),SELECT,H361,AUDIFONOS SELECT H361 EN CAJA COLOR ROJO CON NEGRO NUEVOS / DETALLE DE USO,ver [1] fotos.,$ 125.00,$ 125.00,Chalco Centro,55-4160-5839
25094142.2,AUDIFONOS (usado),REDMI,M2344E1,AUDIFONOS EN ESTUCHE RECARGABLE CON CAJA Y MANUAL / DETALLES D EUSO REDMI M2344E1,ver [1] fotos.,$ 753.00,$ 753.00,Chalco Centro,55-4160-5839
25094296.11,AUDIFONOS (usado),AUDIFONO BT MISIK MH609 EN CAJA,---,$ 96.00,$ 96.00,Chalco Centro,55-4160-5839
25094296.110,AUDIFONOS (usado),AUDIFONO BT MISIK MH609 EN CAJA,---,$ 96.00,$ 96.00,Chalco Centro,55-4160-5839
25094296.111,AUDIFONOS (usado),AUDIFONO BT MISIK MH609 EN CAJA,---,$ 96.00,$ 96.00,Chalco Centro,55-4160-5839
25094296.112,AUDIFONOS (usado),AUDIFONO BT MISIK MH609 EN CAJA,---,$ 96.00,$ 96.00,Chalco Centro,55-4160-5839
25094296.113,AUDIFONOS (usado),AUDIFONO BT MISIK MH609 EN CAJA,---,$ 96.00,$ 96.00,Chalco Centro,55-4160-5839
25094296.114,AUDIFONOS (usado),AUDIFONO BT MISIK MH609 EN CAJA,---,$ 96.00,$ 96.00,Chalco Centro,55-4160-5839
25094296.116,AUDIFONOS (usado),AUDIFONO BT MISIK MH609 EN CAJA,---,$ 96.00,$ 96.00,Chalco Centro,55-4160-5839
25094296.117,AUDIFONOS (usado),AUDIFONO BT MISIK MH609 EN CAJA,---,$ 96.00,$ 96.00,Chalco Centro,55-4160-5839
25094296.118,AUDIFONOS (usado),AUDIFONO BT MISIK MH609 EN CAJA,---,$ 96.00,$ 96.00,Chalco Centro,55-4160-5839
25094296.119,AUDIFONOS (usado),AUDIFONO BT MISIK MH609 EN CAJA,---,$ 96.00,$ 96.00,Chalco Centro,55-4160-5839
25094296.12,AUDIFONOS (usado),AUDIFONO BT MISIK MH609 EN CAJA,---,$ 96.00,$ 96.00,Chalco Centro,55-4160-5839
25094296.120,AUDIFONOS (usado),AUDIFONO BT MISIK MH609 EN CAJA,---,$ 96.00,$ 96.00,Chalco Centro,55-4160-5839
25094296.121,AUDIFONOS (usado),AUDIFONO BT MISIK MH609 EN CAJA,---,$ 96.00,$ 96.00,Chalco Centro,55-4160-5839
25094296.122,AUDIFONOS (usado),AUDIFONO BT MISIK MH609 EN CAJA,---,$ 96.00,$ 96.00,Chalco Centro,55-4160-5839
25094296.13,AUDIFONOS (usado),AUDIFONO BT MISIK MH609 EN CAJA,---,$ 96.00,$ 96.00,Chalco Centro,55-4160-5839
25094296.14,AUDIFONOS (usado),AUDIFONO BT MISIK MH609 EN CAJA,---,$ 96.00,$ 96.00,Chalco Centro,55-4160-5839
25094296.15,AUDIFONOS (usado),AUDIFONO BT MISIK MH609 EN CAJA,---,$ 96.00,$ 96.00,Chalco Centro,55-4160-5839
25094296.17,AUDIFONOS (usado),AUDIFONO BT MISIK MH609 EN CAJA,---,$ 96.00,$ 96.00,Chalco Centro,55-4160-5839
25094296.18,AUDIFONOS (usado),AUDIFONO BT MISIK MH609 EN CAJA,---,$ 96.00,$ 96.00,Chalco Centro,55-4160-5839
25094296.19,AUDIFONOS (usado),AUDIFONO BT MISIK MH609 EN CAJA,---,$ 96.00,$ 96.00,Chalco Centro,55-4160-5839
25094335.1,AUDIFONOS (usado),JBL,JBL,AUDIFONOS JBL JBL AUDIFONOS CON CABLE USB Y ALMUEDILLAS COLOR BLANCO / DETALLES DE USO,ver [1] fotos.,$ 350.00,$ 350.00,Chalco Centro,55-4160-5839
5142241.11,AUDIFONOS (usado),AUDIFONOS INTRAURICULARES CON MICROFONO,---,$ 100.00,$ 100.00,Chalco Centro,55-4160-5839
5142241.14,AUDIFONOS (usado),AUDIFONOS INTRAURICULARES CON MICROFONO,---,$ 100.00,$ 100.00,Chalco Centro,55-4160-5839
58036214.1,AUDIFONOS (usado),APPLE,A2566,"APPLE A2566 AIRPODS DE TERCERA  GENERACION, EN CAJA Y CABLE DE CARGA, ARTICULO EN EXCELENTES CONDICIONES",ver [1] fotos.,$ 970.00,$ 970.00,Chalco Guadalupana,55-5980-4926
58036272.1,AUDIFONOS (usado),LINKBITS,GAM10,"LINKBITS GAM10 AUDIFONOS LINK BITS DE TIPO GAMER NEGROS CON ROJO, SE PRUEBAN EN SUCURSAL",ver [1] fotos.,$ 137.00,$ 137.00,Chalco Guadalupana,55-5980-4926
58036302.110,AUDIFONOS (usado),AUDIFONOS BLUETOOTH EN CAJA,---,$ 40.00,$ 40.00,Chalco Guadalupana,55-5980-4926
58036302.111,AUDIFONOS (usado),AUDIFONOS BLUETOOTH EN CAJA,---,$ 40.00,$ 40.00,Chalco Guadalupana,55-5980-4926
58036302.112,AUDIFONOS (usado),AUDIFONOS BLUETOOTH EN CAJA,---,$ 40.00,$ 40.00,Chalco Guadalupana,55-5980-4926
58036302.115,AUDIFONOS (usado),AUDIFONOS BLUETOOTH EN CAJA,---,$ 40.00,$ 40.00,Chalco Guadalupana,55-5980-4926
58036302.116,AUDIFONOS (usado),AUDIFONOS BLUETOOTH EN CAJA,---,$ 40.00,$ 40.00,Chalco Guadalupana,55-5980-4926
58036302.117,AUDIFONOS (usado),AUDIFONOS BLUETOOTH EN CAJA,---,$ 40.00,$ 40.00,Chalco Guadalupana,55-5980-4926
58036302.118,AUDIFONOS (usado),AUDIFONOS BLUETOOTH EN CAJA,---,$ 40.00,$ 40.00,Chalco Guadalupana,55-5980-4926
58036302.119,AUDIFONOS (usado),AUDIFONOS BLUETOOTH EN CAJA,---,$ 40.00,$ 40.00,Chalco Guadalupana,55-5980-4926
58036302.120,AUDIFONOS (usado),AUDIFONOS BLUETOOTH EN CAJA,---,$ 40.00,$ 40.00,Chalco Guadalupana,55-5980-4926
58036302.122,AUDIFONOS (usado),AUDIFONOS BLUETOOTH EN CAJA,---,$ 40.00,$ 40.00,Chalco Guadalupana,55-5980-4926
58036302.123,AUDIFONOS (usado),AUDIFONOS BLUETOOTH EN CAJA,---,$ 40.00,$ 40.00,Chalco Guadalupana,55-5980-4926
58036302.13,AUDIFONOS (usado),AUDIFONOS BLUETOOTH EN CAJA,---,$ 40.00,$ 40.00,Chalco Guadalupana,55-5980-4926
58036302.14,AUDIFONOS (usado),AUDIFONOS BLUETOOTH EN CAJA,---,$ 40.00,$ 40.00,Chalco Guadalupana,55-5980-4926
58036302.15,AUDIFONOS (usado),AUDIFONOS BLUETOOTH EN CAJA,---,$ 40.00,$ 40.00,Chalco Guadalupana,55-5980-4926
58036302.16,AUDIFONOS (usado),AUDIFONOS BLUETOOTH EN CAJA,---,$ 40.00,$ 40.00,Chalco Guadalupana,55-5980-4926
58036302.19,AUDIFONOS (usado),AUDIFONOS BLUETOOTH EN CAJA,---,$ 40.00,$ 40.00,Chalco Guadalupana,55-5980-4926
58036327.1,AUDIFONOS (usado),SONY,MDRZX310AP,"SONY MDRZX310AP AUDIFONOS DIADEMA, COLOR AZUL, CON CABLE DE CONEXION, ARTICULO EN CONDICION DE USO",ver [1] fotos.,$ 143.00,$ 143.00,Chalco Guadalupana,55-5980-4926
58036598.1,AUDIFONOS (usado),APPLE,A1602,"APPLE A1602 AIRPODS DE SEGUNDA  GENERACION, EN CAJA, CON CABLE DE CARGA, ARTICULO EN BUEN ESTADO DE USO",ver [1] fotos.,$ 736.00,$ 736.00,Chalco Guadalupana,55-5980-4926
58037026.1,AUDIFONOS (usado),APPLE,A2190,APPLE A2190,ver [1] fotos.,$ 902.00,$ 902.00,Chalco Guadalupana,55-5980-4926
58037105.2,AUDIFONOS (usado),ROHS,IFFRWE,"ROHS IFFRWE AUDIFONOS INALMBRICOS, COLOR BLANCO, RAY Y MALT",ver [1] fotos.,$ 156.00,$ 156.00,Chalco Guadalupana,55-5980-4926
58037105.3,AUDIFONOS (usado),ROHS,IFIEPP29,"ROHS IFIEPP29 AUDIFONOS COLOR MORADOS, CABLE DE CARGA, RAY Y MALT",ver [1] fotos.,$ 149.00,$ 149.00,Chalco Guadalupana,55-5980-4926
58037105.4,AUDIFONOS (usado),MOBO,BUDS100,"MOBO BUDS100 AUDIFONOS COLOR AZUL, CABLE DE CARGA, RAY Y MALT",ver [1] fotos.,$ 115.00,$ 115.00,Chalco Guadalupana,55-5980-4926
58037226.1,AUDIFONOS (usado),COMPAQ,SM,"COMPAQ SM AUDIFONOS COLOR NEGROS, CABLE DE CARGA, RAY Y MALT",ver [1] fotos.,$ 201.00,$ 201.00,Chalco Guadalupana,55-5980-4926
58037413.1,AUDIFONOS (usado),LG,TONETF7Q,"LG TONETF7Q AUDIFONOS INALAMBRICOS LG, COLOR NEGRO, CABLE DE CARGA, ESTUCHE RAY Y MALT",ver [1] fotos.,"$ 1,061.00","$ 1,061.00",Chalco Guadalupana,55-5980-4926
58037469.1,AUDIFONOS (usado),ONIKUMA,K5,"ONIKUMA K5 AUDIFONOS TIPO GAMER COLOR ROSA, ARTICULO EN CONDICIONES DE USO RAY",ver [1] fotos.,$ 176.00,$ 176.00,Chalco Guadalupana,55-5980-4926
58037585.1,AUDIFONOS (usado),APPLE,A2096,"APPLE A2096 AUDIFONOS DE DIADEMA EN CAJA CON CARGADOR Y PROTECTOR, EN BUENAS CONDIONES",ver [1] fotos.,"$ 2,159.00","$ 2,159.00",Chalco Guadalupana,55-5980-4926
58038098.1,AUDIFONOS (usado),SONY,MDRXB950BT,AUDIFONOS SONY MDRXB950BT COLOR ROJO EN CAJA CON CABLE USB RAY/MAL NADA QUE AFECTE FUNCIONAMIENTO DETALLES DE USO,ver [1] fotos.,$ 160.00,$ 160.00,Chalco Guadalupana,55-5980-4926
58038556.1,AUDIFONOS (usado),MOTOROLA,MOTOXT2404394,MOTOROLA MOTOXT2404394 AIDONOS MOTOROLA EN BUENAS CONDICIONES,ver [1] fotos.,$ 650.00,$ 650.00,Chalco Guadalupana,55-5980-4926
58038556.2,AUDIFONOS (usado),MOTOROLA,MOTOXT2404394,MOTOROLA MOTOXT2404394 AUDIFONOS SIN CABLE DE CARGA EN BUENAS CONDICIONES,ver [1] fotos.,$ 650.00,$ 650.00,Chalco Guadalupana,55-5980-4926
58038674.1,AUDIFONOS (usado),PLANTRONICS,VOYAGER5200,"PLANTRONICS VOYAGER5200 AUDIFONOS MANOS LIBRES BLUETOOTH, CON ESTUCHE DE CARFA Y CARGADOR, ARTICULO EN CONDICIONES DE USO RAY",ver [1] fotos.,$ 700.00,$ 700.00,Chalco Guadalupana,55-5980-4926
58038795.1,AUDIFONOS (usado),MOTOROLA,XT24431,"MOTOROLA XT24431 MOTO BUDS ESTUCHE BLANCO, ARTICULO EN CONDICIONES DE USO, SIN CABLE DE CARGA",ver [1] fotos.,$ 500.00,$ 500.00,Chalco Guadalupana,55-5980-4926
8133482.120,AUDIFONOS (usado),AUDIFONO EN CAJA MISIK,---,$ 61.00,$ 61.00,Chalco Guadalupana,55-5980-4926
8133482.122,AUDIFONOS (usado),AUDIFONO EN CAJA MISIK,---,$ 61.00,$ 61.00,Chalco Guadalupana,55-5980-4926
8133482.123,AUDIFONOS (usado),AUDIFONO EN CAJA MISIK,---,$ 61.00,$ 61.00,Chalco Guadalupana,55-5980-4926
8133482.124,AUDIFONOS (usado),AUDIFONO EN CAJA MISIK,---,$ 61.00,$ 61.00,Chalco Guadalupana,55-5980-4926
8133482.125,AUDIFONOS (usado),AUDIFONO EN CAJA MISIK,---,$ 61.00,$ 61.00,Chalco Guadalupana,55-5980-4926
52060250.1,AUDIFONOS (usado),XIAOMI,BUDS3TPRO,"AUDIFONOS XIAOMI BUDS3TPRO EN CAJA , CABLE.",ver [1] fotos.,$ 894.00,$ 894.00,Chalco Soriana Valle,55-5985-0291
52060301.1,AUDIFONOS (usado),JABRA,HSC100W,"AURICULARES, JABRA HSC100W , COLOR NEGRO INALAMBRICOS, SIN CARGADOR, LIGEROS DETALLES DE USO.",ver [1] fotos.,"$ 1,225.00","$ 1,225.00",Chalco Soriana Valle,55-5985-0291
52060508.1,AUDIFONOS (usado),SHURE,SRH840A,"AUDIFONOS, SHURE SRH840A , PROFESIONALES, COLOR NEGRO CON DORADO, CABLE CON ACCESORIO PROFF, LIFEROS DETALLES.",ver [1] fotos.,"$ 1,225.00","$ 1,225.00",Chalco Soriana Valle,55-5985-0291
52061439.1,AUDIFONOS (usado),APPLE,A1602,AUDIFONOSA PPLE A1602 COLOR BLANCO DETALLES DE USO BUEN FUNCIONAMIENTO APPLE A1602,ver [1] fotos.,$ 794.00,$ 794.00,Chalco Soriana Valle,55-5985-0291
52061475.1,AUDIFONOS (usado),SONY,YY2948,AUDIFONOS SONY YY2948 COLOR NEGRO EN CAJA CON GOMAS ADICIONALES RAY/MAL NADA QUE AFECTE FUNCIONAMIENTO DETALLES DE USO,ver [1] fotos.,"$ 1,650.00","$ 1,650.00",Chalco Soriana Valle,55-5985-0291
52062192.1,AUDIFONOS (usado),BOSE,SIE2I,AURICULARES BOSE SIE2I CON ACCESORIOS COLOR NARANJA,ver [1] fotos.,$ 858.00,$ 858.00,Chalco Soriana Valle,55-5985-0291
52062244.1,AUDIFONOS (usado),APPLE,A2700,AUDIFONOS APPLE A2700 CON CABLE USB RAY/MAL DETALLES DE USO,ver [1] fotos.,"$ 1,212.00","$ 1,212.00",Chalco Soriana Valle,55-5985-0291
52062305.1,AUDIFONOS (usado),APPLE,A2700,AUDIFONOS APPLE A2700 ESTUCHE SIN CARGADOR RAY/MAL CLON DETALLES DE USO,ver [1] fotos.,$ 550.00,$ 550.00,Chalco Soriana Valle,55-5985-0291
52062456.1,AUDIFONOS (usado),SKULLCANDY,S5PRW,"AUDIFONOS DE DIADEMA SKULLCANDY S5PRW COLOR NEGRO,CABLE DE CORRIENTE,CABLE DE CARGA,RAY/MAL CON SEÑAS DE USO",ver [1] fotos.,$ 484.00,$ 484.00,Chalco Soriana Valle,55-5985-0291
52062476.1,AUDIFONOS (usado),HONOR,PRGME00,AUDIFONOS HONOR PRGME00 EN ESTUCHE EN CAJA DETALLES DE USO COMUN,ver [1] fotos.,$ 410.00,$ 410.00,Chalco Soriana Valle,55-5985-0291
52062554.1,AUDIFONOS (usado),SKULLCANDY,S2RLW,AUDIFONOS SKULLCANDY S2RLW CON ESTUCHE DETALLES POR USO COMUN SIN CARGADOR,ver [1] fotos.,$ 969.00,$ 969.00,Chalco Soriana Valle,55-5985-0291
52062578.1,AUDIFONOS (usado),APPLE,A1602,"AIRPODS APPLE A1602 2DA GENERACION,ESTUCHE DE CARGA INALAMBRICA,COLOR BLANCO,CABLE DE CARGA,RAY/MAL CON SEÑAS DE USO",ver [1] fotos.,"$ 1,000.00","$ 1,000.00",Chalco Soriana Valle,55-5985-0291
52062643.1,AUDIFONOS (usado),MOTOROLA,XT24431,AUDIFONOS MOTOROLA XT24431 EN BUEN ESTADO CABLE USB DETALLES POR USO COMUN,ver [1] fotos.,$ 651.00,$ 651.00,Chalco Soriana Valle,55-5985-0291
52062674.1,AUDIFONOS (usado),UNDERARMOUR,SPORTWIRELESSTRAIN,AUDIFONOS UNDERARMOUR SPORTWIRELESSTRAIN CABLE USB DETALLES POR USO COMUN,ver [1] fotos.,"$ 2,114.00","$ 2,114.00",Chalco Soriana Valle,55-5985-0291
52062816.1,AUDIFONOS (usado),APPLE,A1602,AUDIFONOS APPLE A1602 CON ESTUCHE CABLE USB EN CAJA DETALLES POR USO COMUN,ver [1] fotos.,"$ 1,234.00","$ 1,234.00",Chalco Soriana Valle,55-5985-0291
52062994.1,AUDIFONOS (usado),SONY,WIC100,"AUDIFONOS INALAMBRICOS SONY WIC100 COLOR NEGRO,BT,EN CAJA,RAY/MAL CON SEÑAS DE USO",ver [1] fotos.,$ 345.00,$ 345.00,Chalco Soriana Valle,55-5985-0291
52063093.2,AUDIFONOS (usado),JBL,QUANTUM600,"AUDIFONOS GAMER JBL QUANTUM600 COLOR NEGRO,CABLE AUXILIAR,RAY/MAL CON SEÑAS DE USO",ver [1] fotos.,$ 976.00,$ 976.00,Chalco Soriana Valle,55-5985-0291
52063431.1,AUDIFONOS (usado),SKULLCANDY,S6CAW,"AUDIFONOS DE DIADEMA SKULLCANDY S6CAW NEGROS,CONEX BT,BOLSA/ESTUCHE,CABLE DE CARGA,SEMI NUEVO",ver [1] fotos.,"$ 1,999.00","$ 1,999.00",Chalco Soriana Valle,55-5985-0291
52063451.1,AUDIFONOS (usado),OPPO,ETE41,"AUDIFONOS OPPO ETE41 ,EN CAJA,CABLE USB,COLOR VERDE,DETALLES DE USO",ver [1] fotos,$ 391.00,$ 391.00,Chalco Soriana Valle,55-5985-0291
52063479.1,AUDIFONOS (usado),REDMI,M2317E1,"AUDIFONOS REDMI M2317E1 // COLOR NEGRO ,CABLE , DETALLES DE USO SERIE 24662M2317E1",ver [1] fotos.,$ 483.00,$ 483.00,Chalco Soriana Valle,55-5985-0291
52063762.1,AUDIFONOS (usado),APPLE,A3058,"AIRPODS 4 APPLE A3058 4 GEN,COLOR BLANCO,ESTUCHE DE CARGA INALAMBRICA,SERIE GN70KV6F9Q,ABIERTOS EN SUCURSAL/NUEVOS",ver [1] fotos.,"$ 1,986.00","$ 1,986.00",Chalco Soriana Valle,55-5985-0291
52063777.1,AUDIFONOS (usado),SAMSUNG,SMR180,AUDIFONOS SAMSUNG SMR180 COLOR ROJA CON CABLE RAY MALT X USO,ver [1] fotos,$ 572.00,$ 572.00,Chalco Soriana Valle,55-5985-0291
52063834.1,AUDIFONOS (usado),JBL,TUNE225TWS,AUDIFONOS JBL TUNE225TWS CON CABLE USB COLOR NEGRO EN SU ESTUCHE,ver [1] fotos.,$ 506.00,$ 506.00,Chalco Soriana Valle,55-5985-0291
8133482.115,AUDIFONOS (usado),AUDIFONO EN CAJA MISIK,---,$ 80.00,$ 80.00,Chalco Soriana Valle,55-5985-0291
8133482.116,AUDIFONOS (usado),AUDIFONO EN CAJA MISIK,---,$ 80.00,$ 80.00,Chalco Soriana Valle,55-5985-0291
8133482.117,AUDIFONOS (usado),AUDIFONO EN CAJA MISIK,---,$ 80.00,$ 80.00,Chalco Soriana Valle,55-5985-0291
8133482.119,AUDIFONOS (usado),AUDIFONO EN CAJA MISIK,---,$ 80.00,$ 80.00,Chalco Soriana Valle,55-5985-0291
37028340.1,AUDIFONOS (usado),APPLE,A2566,AUDIFONOS APPLE A2566 EN CAJA AIPODS CON FOLLETERIA Y CABLE LIGTH,ver [1] fotos.,$ 600.00,$ 600.00,Chilpancingo,55-4160-5746
37030025.3,AUDIFONOS (usado),JBL,ENDURANCEPEAK,A7UDIFONOS JBL ENDURANCEPEAK ENDURENCE PEAK NEGRO CON CABLE NARANJA DESGASTE DE USO,ver [1] fotos.,$ 600.00,$ 600.00,Chilpancingo,55-4160-5746
37030170.1,AUDIFONOS (usado),IFROGZ,XD2,IFROGZ XD2 AUDIFONOS IFROGZ  BT CON CAJA CABLE DE CARGA,ver [1] fotos.,$ 544.00,$ 544.00,Chilpancingo,55-4160-5746
37030266.1,AUDIFONOS (usado),JAYBIRD,X3,"JAYBIRD X3 JAYBIRD VISTA TRUE WIRELESS BLUETOOTH SPORT - AURICULARES DE DIADEMA RESISTENTES AL AGUA, COLOR NEGRO",ver [1] fotos.,$ 450.00,$ 450.00,Chilpancingo,55-4160-5746
37030307.1,AUDIFONOS (usado),PLANTRONICS,B825,AUDIFONOS PLANTRONICS B825 COLOR NEGRO Y LA BASE COLOR NEGRA,ver [1] fotos.,"$ 1,300.00","$ 1,300.00",Chilpancingo,55-4160-5746
37030353.2,AUDIFONOS (usado),JAYBIRD,MS,JAYBIRD MS COLOR NEGRO DETALLES DE USO,ver [1] fotos.,$ 500.00,$ 500.00,Chilpancingo,55-4160-5746
37030583.1,AUDIFONOS (usado),COMPAQ,TRUEWIRELESS,AUDIFONOS COMPAQ TRUEWIRELESS COLOR NEGRO SN DETALLES DE USO,ver [1] fotos.,$ 976.00,$ 976.00,Chilpancingo,55-4160-5746
37030619.2,AUDIFONOS (usado),BEATS,IPX4,AUDIFONOS BEATS IPX4 COLOR NEGROS SIN CALE DE CARGA Y DETALLES RAYADOS,ver [1] fotos.,$ 635.00,$ 635.00,Chilpancingo,55-4160-5746
37030621.1,AUDIFONOS (usado),SONY,WFL5900,AUDIFONOS SONY WFL5900 COLOR CAFE CLARO CON CAJA DETALLES MINIMOS DE USO,ver [1] fotos.,"$ 1,100.00","$ 1,100.00",Chilpancingo,55-4160-5746
37030677.1,AUDIFONOS (usado),JBL,LIVEBEAM3,AUDIFONOS JBL LIVEBEAM3 COLOR NEGROS CABLE ORIGINAL DETALLES MINIMOS DE USPO Y CAJA,ver [1] fotos.,"$ 1,900.00","$ 1,900.00",Chilpancingo,55-4160-5746
37030826.1,AUDIFONOS (usado),FIIO,FH3,"AURICULARES CON CABLE DE ALTA RESOLUCIÓN, SONIDO DE GRAVES INTRAURALES, AURICULARES FIIO FH3 Y DOBLE CABLE",ver [1] fotos.,"$ 1,000.00","$ 1,000.00",Chilpancingo,55-4160-5746
37031048.1,AUDIFONOS (usado),HONOR,ORLME00,AUDIFONOS HONOR ORLME00 OPEN-EAR ORL-ME00 TRUE WIRELESS EARBUDS COLOR NEGRO,ver [1] fotos.,$ 511.00,$ 511.00,Chilpancingo,55-4160-5746
59030411.1,AUDIFONOS (usado),BEATS,A2043,AURICULAR BEATS A2043 CON ESTUCHE COLOR NEGRO SIN CARGADOR DETALLES D EUSO,ver [1] fotos.,"$ 1,059.00","$ 1,059.00",Chilpancingo,55-4160-5746
56026178.2,AUDIFONOS (usado),JBL,TUNE125TWS,JBL TUNE125TWS /ADIFONOS VIA BLUETOOW DETALLES DEUSO POR CONDCION.,ver [1] fotos.,$ 528.00,$ 528.00,Chimalhuacán Barrio  Artesanos,55-4160-5763
56026178.7,AUDIFONOS (usado),JBL,TUNE125TWS,JBL TUNE125TWS /ADIFONOS VIA BLUETOOW DETALLES DEUSO POR CONDCION.,ver [1] fotos.,$ 528.00,$ 528.00,Chimalhuacán Barrio  Artesanos,55-4160-5763
56026748.1,AUDIFONOS (usado),SONY,WIC200,AUDÍFONOS IN EAR SONY WI-C200/B COLOR NEGRO CABLE USB CAJA BUENAS CODNCIIONES SONY WIC200,ver [1] fotos.,$ 318.00,$ 318.00,Chimalhuacán Barrio  Artesanos,55-4160-5763
92024869.1,AUDIFONOS (usado),OPPO,ENCOAIR3,AUDIFONOS INALAMBRICO OPPO ENCOAIR3 COLOR BLANCO SERIE H6672674D6F01UJ3W EN ESTUCHE SE CHECA SU FUNCIONAMIENTO EN BUEN ESTADO,ver [1] fotos.,$ 356.00,$ 356.00,Chimalhuacán Barrio  Artesanos,55-4160-5763
92025173.1,AUDIFONOS (usado),JABRA,HSC018W,AUDÍFONOS RECARGABLES JABRA HSC018W JABRA 65 COLOR NEGRO EN ESTUCHE CON CABLE DE CARGA //ADAPTADOR USB SE CHECA SU FUNCIONAMIENTO EN BUEN ESTADO,ver [1] fotos.,$ 680.00,$ 680.00,Chimalhuacán Barrio  Artesanos,55-4160-5763
92025692.1,AUDIFONOS (usado),JABRA,W40K,AUDIFONOS JABRA W40K CON ESTUCHE CON CABLE USB CONDICIONES DE USO,ver [1] fotos.,$ 506.00,$ 506.00,Chimalhuacán Barrio  Artesanos,55-4160-5763
92026703.1,AUDIFONOS (usado),SAMSUNG,SMR180,SAMSUNG SMR180 AUDÍFONOS IN-EAR INALÁMBRICOS SAMSUNG GALAXY BUDS LIVE BRONC COLOR DORADO OSCURO COLOR DE LA LUZ DORADO EN BUENAS CONDICIONES LEVES RAYONES POR USO DEL ARTICULO,ver [1] fotos.,$ 453.00,$ 453.00,Chimalhuacán Barrio  Artesanos,55-4160-5763
92027552.1,AUDIFONOS (usado),JBL,TUNEBUDS,JBL TUNEBUDS JBL TUNE BUD AUDIFONIS SIN CABLE,ver [1] fotos.,$ 333.00,$ 333.00,Chimalhuacán Barrio  Artesanos,55-4160-5763
92027961.1,AUDIFONOS (usado),JABRA,HSC017,JABRA HSC017 AUDÍFONOS JABRA EVOLVE 40 EN ESTUCHE CON MANUALES EN CONDICIONES DE USO PROBADOS Y FUNCIONANDO LIGEROS DETALLES ESTÉTICOS,ver [1] fotos.,$ 487.00,$ 487.00,Chimalhuacán Barrio  Artesanos,55-4160-5763
92028467.1,AUDIFONOS (usado),SONY,NWWS623,"AUDIFONOS SONY NWWS623 REPRODUCTOR MP3 ,COLOR GRIS ,EN CAJA CON CARGADOR Y CABLE USB PROBADO, FUNCIONANDO LIGEROS DETALLES ESTETICOS",ver [1] fotos.,$ 950.00,$ 950.00,Chimalhuacán Barrio  Artesanos,55-4160-5763
92028716.1,AUDIFONOS (usado),TOZO,T10,"AUDIFONOS TOZO T10 COLOR NEGROS CON CABLE DE CARGA PROBADO, FUNCIONANDO CON LIGEROS DETALLES ESTICOS.",ver [1] fotos.,$ 390.00,$ 390.00,Chimalhuacán Barrio  Artesanos,55-4160-5763
92029489.1,AUDIFONOS (usado),HONOR,ROSME01,AUDIFONOS HONOR ROSME01 EN CAJA CON CABLE ARTICULO USADO,ver [1] fotos.,$ 486.00,$ 486.00,Chimalhuacán Barrio  Artesanos,55-4160-5763
92029627.2,AUDIFONOS (usado),SAMSUNG,SMR400N,AUDIFONOS SAMSUNG SMR400N EN CAJA DETALLES Y DESGASTE POR USO CON CAJA Y CABLE DE CARGA ARTICULO USADO,ver [1] fotos.,$ 787.00,$ 787.00,Chimalhuacán Barrio  Artesanos,55-4160-5763
92029678.1,AUDIFONOS (usado),QCY,BH23H3A,QCY BH23H3A AUDOFONOS BT CON CABLE DE CARGA,ver [1] fotos,$ 403.00,$ 403.00,Chimalhuacán Barrio  Artesanos,55-4160-5763
92029812.1,AUDIFONOS (usado),HONOR,ROSME01,"AUDIFONOS HONOR ROSME01 COLOR NEGRO, EN CAJA  CON CABLE PARA CARGAR",ver [1] fotos.,$ 354.00,$ 354.00,Chimalhuacán Barrio  Artesanos,55-4160-5763
92029879.1,AUDIFONOS (usado),LG,T90S,AUDIFONOS LG T90S EN ESTADO REGULAR CON DETALLES Y DESGASTE POR USO,ver [1] fotos,$ 786.00,$ 786.00,Chimalhuacán Barrio  Artesanos,55-4160-5763
