Prenda / Sku Lote,Familia,Marca,Modelo,Descripción,Imagenes,Precio Venta,Precio Promoción,Tienda,Tel. Tienda
209009734.1,AUDIFONOS (usado),HELVEX,COM660,"DIADEMA GAMER HELVEX COM660 //COLOR NEGRO,EN CAJA,CON PILAS,RAY MAL,DETALLES DE USO.",ver [1] fotos.,$ 592.00,$ 592.00,Nezahualcóyotl Madrugada,55-5980-4924
57030432.1,AUDIFONOS (usado),OTRA MARCA,SM,OTRA MARCA(BLUEPARROT) SM AURICULAR SIN CAJA CON CABLE USB DE CARGA DESGSTE DE USO,ver [1] fotos.,$ 450.00,$ 450.00,Nezahualcóyotl Madrugada,55-5980-4924
57031894.1,AUDIFONOS (usado),BEATS,SM,AUDIFONOS BLUETOOTH BEATS SM (8100001201) SEMI PROFECIONALES DE DJ BUEN FUNCIONAMIENTO,ver [1] fotos.,"$ 1,521.00","$ 1,521.00",Nezahualcóyotl Madrugada,55-5980-4924
57032462.1,AUDIFONOS (usado),JABRA,ENA003,AUDÍFONOS CON ALTAVOZ JABRA ENA003 BUEN FUNCIONAMIENTO EN EMPAQUE,ver [1] fotos.,$ 216.00,$ 216.00,Nezahualcóyotl Madrugada,55-5980-4924
57032594.2,AUDIFONOS (usado),SENNHEISER,MM450X,SENNHEISER MM450X AUDIFONOS BLUETHOO COLOR NEGRO CON PLATA CON DES USO RAY SUC MAL,ver [1] fotos.,"$ 1,039.00","$ 1,039.00",Nezahualcóyotl Madrugada,55-5980-4924
57032615.1,AUDIFONOS (usado),OTRA MARCA,ADH300,OTRA MARCA(ARTISTE) ADH300 ADUFINOS ARTISTE COLOR NEGRO CON BASE Y CABLE EN CAJA CON DES-USO RAY SUC MAL,ver [1] fotos.,$ 438.00,$ 438.00,Nezahualcóyotl Madrugada,55-5980-4924
57033091.1,AUDIFONOS (usado),VOLTEDGE,TX50PS5WH,AUIDIFONOS GAMER PARA PS5 VOLTEDGE TX50PS5WH BUEN FUNCIONAMIENTO DETALLES DE USO,ver [1] fotos.,$ 307.00,$ 307.00,Nezahualcóyotl Madrugada,55-5980-4924
57033644.1,AUDIFONOS (usado),HYPERX,HXHSCSCBK,HYPERX HXHSCSCBK AUDIFONOS GAMER HYPERX COLOR NEGRO CON AZUL CON LIG-DES-USO RAY SUC MAL,ver [1] fotos.,$ 565.00,$ 565.00,Nezahualcóyotl Madrugada,55-5980-4924
57033687.1,AUDIFONOS (usado),JBL,TOURONEM2,AUDIFONOS JBL TOURONEM2 BUEN FUNCIONAMIENTO DETALLES LIGEROS  EN ESTUCHE,ver [1] fotos.,"$ 1,176.00","$ 1,176.00",Nezahualcóyotl Madrugada,55-5980-4924
57034147.1,AUDIFONOS (usado),POLY,BLACKWIRE8225,POLY BLACKWIRE8225 //AUDICULARES COLOR NEGRO EN CAJA//CONDICIONES DE USO,ver [1] fotos.,$ 815.00,$ 815.00,Nezahualcóyotl Madrugada,55-5980-4924
57034307.1,AUDIFONOS (usado),SKULLCANDY,S6CRW1,SKULLCANDY S6CRW1 AUDIFONOS SKULLCANDY INALAMBRICOS COLOR NEGRO CON FUNDA LIG-DES-USO RAY SUC MAL,ver [1] fotos.,"$ 1,709.00","$ 1,709.00",Nezahualcóyotl Madrugada,55-5980-4924
57034396.1,AUDIFONOS (usado),JLAB,JBUDSMINI,JLAB JBUDSMINI AUDIFONOS JLAB COLOR NEGRO CON CABLE USB EN CAJA LIG-DES-USO RAY SUC MAL,ver [1] fotos.,$ 351.00,$ 351.00,Nezahualcóyotl Madrugada,55-5980-4924
57034504.1,AUDIFONOS (usado),MOTOROLA,XT2443,AUDIFONOS INALAMBRICOS MOTOROLA XT2443 CON ESTUCHE RECARGABLE,ver [1] fotos.,$ 545.00,$ 545.00,Nezahualcóyotl Madrugada,55-5980-4924
57034615.1,AUDIFONOS (usado),PHILIPS,SM,PHILIPS SM AUDIFONOS INALAMBRICOS PHILIPS COLOR NEGRO CON CABLE USB CON LIG-DES-USO RAY SUC MAL,ver [1] fotos.,$ 314.00,$ 314.00,Nezahualcóyotl Madrugada,55-5980-4924
57034761.1,AUDIFONOS (usado),BASEUS,MA10,BASEUS MA10 AUDIFONOS BASEUS COLOR NEGRO CON DES-USO RAY SUC MAL SIN CABLE USB,ver [1] fotos.,$ 595.00,$ 595.00,Nezahualcóyotl Madrugada,55-5980-4924
57034761.2,AUDIFONOS (usado),BASEUS,BOWIEMA10,BASEUS BOWIEMA10 AUDIFONOS BASEUS COLOR NEGRO CON DES-USO RAY SUC MAL,ver [1] fotos.,$ 595.00,$ 595.00,Nezahualcóyotl Madrugada,55-5980-4924
57034761.3,AUDIFONOS (usado),BASEUS,BOWIEMA10,BASEUS BOWIEMA10 AUDIFONOS INALAMBRICOS BASEUS  CON CABLE USB CON LIG-DES-USO RAY SUC MAL,ver [1] fotos.,$ 595.00,$ 595.00,Nezahualcóyotl Madrugada,55-5980-4924
57034777.1,AUDIFONOS (usado),BASEUS,BOWIEMA10,BASEUS BOWIEMA10 AUDIFONOS INALAMBRICOS BASEUS  CON CABLE USB CON LIG-DES-USO RAY SUC MAL,ver [1] fotos.,$ 595.00,$ 595.00,Nezahualcóyotl Madrugada,55-5980-4924
57034787.2,AUDIFONOS (usado),LG,TONET90Q,LG TONET90Q AUDIFONOS LG TONE T90Q COLOR NEGRO CON CABLE USB CON LIG-DES-USO RAY SUC MAL,ver [1] fotos.,"$ 1,281.00","$ 1,281.00",Nezahualcóyotl Madrugada,55-5980-4924
57034929.1,AUDIFONOS (usado),SKULLCANDY,S6CRW,AUDIFONOS  INALAMBRICOS SKULLCANDY S6CRW BUEN FUNCIONAMIENTO,ver [1] fotos.,"$ 1,450.00","$ 1,450.00",Nezahualcóyotl Madrugada,55-5980-4924
57035604.2,AUDIFONOS (usado),STOCK,SM,AUDIFONOS STOCK SM DE DIADEMA EN EMPAQUE,ver [1] fotos.,$ 214.00,$ 214.00,Nezahualcóyotl Madrugada,55-5980-4924
57035661.1,AUDIFONOS (usado),STEREN,SM,AUDIFONOS STEREN SM DE DIADEMA BUEN FUNCIONAMIENTO DETALLES DE USO,ver [1] fotos.,$ 194.00,$ 194.00,Nezahualcóyotl Madrugada,55-5980-4924
57035698.1,AUDIFONOS (usado),XBOX,ASTROA10,XBOX ASTROA10 //AUDIFONOS PARA XBOX COLOR NEGRO EN CAJA//CONDCIONES DE USO,ver [1] fotos.,"$ 1,030.00","$ 1,030.00",Nezahualcóyotl Madrugada,55-5980-4924
57035740.2,AUDIFONOS (usado),HYPER,CLOUDSTINGER,AUDIFONOS DE DIADEMA HYPER CLOUDSTINGER EN EMPAQUE  BUEN FUNCIONAMIENTO,ver [1] fotos.,$ 449.00,$ 449.00,Nezahualcóyotl Madrugada,55-5980-4924
57035744.1,AUDIFONOS (usado),BEATS,FLEX,AUDIFONOS  INALAMBRICOS  RECARGABLES BLUETOOTH  AMARILLOS BEATS FLEX,ver [1] fotos.,$ 844.00,$ 844.00,Nezahualcóyotl Madrugada,55-5980-4924
57035768.1,AUDIFONOS (usado),MOTOROLA,XT24431,AUDÍFONOS BLUETOOTH  CON ESTUCHE RECARGABLE MOTOROLA XT24431 BUEN FUNCIONAMIENTO,ver [1] fotos.,$ 578.00,$ 578.00,Nezahualcóyotl Madrugada,55-5980-4924
57035893.1,AUDIFONOS (usado),SKULLCANDY,S6CRW,SKULLCANDY S6CRW AUDIFONOS SKULLCANDY COLOR BEIGE CON CAFE Y GRIS  CON LIG-DES-USO RAY SUC MAL,ver [1] fotos.,"$ 1,258.00","$ 1,258.00",Nezahualcóyotl Madrugada,55-5980-4924
57035915.1,AUDIFONOS (usado),SONY,YY2966,SONY YY2966 //AUDIFONOS DE DIADEMA SONY COLOR NEGRO SIN CABLE DE CARAG//CONDICIONES DE USO,ver [1] fotos.,"$ 1,246.00","$ 1,246.00",Nezahualcóyotl Madrugada,55-5980-4924
57036132.1,AUDIFONOS (usado),OTRA MARCA,FOKUS,AUDIFONOS DE DIADEMA OTRA MARCA(ONANOFF) FOKUS,ver [1] fotos.,$ 900.00,$ 900.00,Nezahualcóyotl Madrugada,55-5980-4924
57036174.1,AUDIFONOS (usado),REDMI,M2317E1,AUDIFONOS BLUETOOTH REDMI M2317E1 CON ESTUCHE RACARGABLE  BUEN FUNKCIONAMIENTO,ver [1] fotos.,$ 742.00,$ 742.00,Nezahualcóyotl Madrugada,55-5980-4924
57036197.1,AUDIFONOS (usado),JBL,TL1480,AUDIFONOS BLUETOOTH  DE DIADEMA JBL TL1480 BUEN FUNCIONAMIENTO CON CABLE DE  CARGA,ver [1] fotos.,$ 651.00,$ 651.00,Nezahualcóyotl Madrugada,55-5980-4924
57036263.1,AUDIFONOS (usado),APPLE,A2700,AUDIFONOS AIRPODS PRO 2 (USB-C) APPLE A2700 BUEN FUNCIONAMIENTO,ver [1] fotos.,"$ 1,786.00","$ 1,786.00",Nezahualcóyotl Madrugada,55-5980-4924
57036319.1,AUDIFONOS (usado),HUAWEI,T0014L,AUDIFONOS INALAMBRICOS  BLUETOOTH CON ESTUCHE RECARGABLE HUAWEI T0014L BUEN FUNCIONAMIENTO,ver [1] fotos.,$ 601.00,$ 601.00,Nezahualcóyotl Madrugada,55-5980-4924
57036327.1,AUDIFONOS (usado),TASCAM,THMX2,TASCAM THMX2 AUDIFONOS DE DIADEMA TASCAM RAY. MAL. SUC. DETALLES DE USO,ver [1] fotos.,$ 709.00,$ 709.00,Nezahualcóyotl Madrugada,55-5980-4924
57036363.1,AUDIFONOS (usado),TRUEFREE,SM,AUDIFONOS INALAMBRICOS BLUETOOTH  CON ESTUCHE RECARGABLE OTRA MARCA(TRUEFREE) SM,ver [1] fotos.,$ 512.00,$ 512.00,Nezahualcóyotl Madrugada,55-5980-4924
57036422.1,AUDIFONOS (usado),SAMSUNG,SMR180,SAMSUNG SMR180,ver [1] fotos.,"$ 1,924.00","$ 1,924.00",Nezahualcóyotl Madrugada,55-5980-4924
57036486.1,AUDIFONOS (usado),LINKBITS,AB038,LINKBITS AB038 AUDIFONOS COLOR NEGRO CON CAJA,ver [1] fotos,$ 219.00,$ 219.00,Nezahualcóyotl Madrugada,55-5980-4924
57036577.1,AUDIFONOS (usado),APPLE,A2083,APPLE A2083 AUDIFONOS IPOD PRO2 BLANCOS EN CAJA CON ESTUCHE DE CARGA,ver [1] fotos.,"$ 1,246.00","$ 1,246.00",Nezahualcóyotl Madrugada,55-5980-4924
26050478.1,AUDIFONOS (usado),SENNHEISER,GPS600,AUDIFONOS ALAMBRICOS SENNHEISER GPS600 COLOR NEGRO EN CAJA DESGASTE POR USO,ver [1] fotos.,"$ 1,074.00","$ 1,074.00",Nicolás Romero,55-4160-5743
26051177.1,AUDIFONOS (usado),SM,SM,AUDÍFONOS SM SM COLOR NEGRO CON CAJA  DESGASTE POR USO,ver [1] fotos.,$ 673.00,$ 673.00,Nicolás Romero,55-4160-5743
26051391.1,AUDIFONOS (usado),JABRA,ELITEACTIVE65T,AUDIFONOS INALAMBRICOS JABRA ELITEACTIVE65T COLOR NEGRO DESGASTE POR USO,ver [1] fotos.,$ 405.00,$ 405.00,Nicolás Romero,55-4160-5743
26051709.1,AUDIFONOS (usado),BILLBOARD,BBE119801,AUDIFONOS INALAMBRICOS BILLBOARD BBE119801 COLOR VERDE DESGASTE POR USO,ver [1] fotos.,$ 209.00,$ 209.00,Nicolás Romero,55-4160-5743
26051726.1,AUDIFONOS (usado),HUAWEI,SM,HUAWEI SM T003C  COLOR GRIS CON CABLE USB,ver [1] fotos.,"$ 1,353.00","$ 1,353.00",Nicolás Romero,55-4160-5743
26052264.1,AUDIFONOS (usado),BILLBOARD,NATIVE,AUDIFONOS BILLBOARD NATIVE EN CAJA,ver [1] fotos.,$ 273.00,$ 273.00,Nicolás Romero,55-4160-5743
26052264.2,AUDIFONOS (usado),SELECT SOUND,BTH02,AUDIFONOS SELECT SOUND BTH02 2 EN CAJA,ver [1] fotos.,$ 197.00,$ 197.00,Nicolás Romero,55-4160-5743
26052330.2,AUDIFONOS (usado),STF,SOAR,AUDIFONOS STF SOAR INALAMBRICOS CON CAJA DESGASTE POR USO,ver [1] fotos.,$ 230.00,$ 230.00,Nicolás Romero,55-4160-5743
26052372.3,AUDIFONOS (usado),SELECT SOUND,BTH022,SELECT SOUND BTH022 AUDIFONOS EN CAJA,ver [1] fotos.,$ 168.00,$ 168.00,Nicolás Romero,55-4160-5743
26052372.4,AUDIFONOS (usado),SELECT SOUND,BTH022,SELECT SOUND BTH022 AUDIFONOS EN CAJA,ver [1] fotos,$ 168.00,$ 168.00,Nicolás Romero,55-4160-5743
26052372.5,AUDIFONOS (usado),STF,SOAR,STF SOAR AUDIFONOS EN CAJA,ver [1] fotos.,$ 185.00,$ 185.00,Nicolás Romero,55-4160-5743
26052404.1,AUDIFONOS (usado),THRUSTMASTER,TRACING,AUDÍFONOS ALÁMBRICOS COLOR ROJO EN CAJA DESGASTE POR USO THRUSTMASTER TRACING,ver [1] fotos.,"$ 1,200.00","$ 1,200.00",Nicolás Romero,55-4160-5743
26052408.1,AUDIFONOS (usado),THRUSTMASTER,350CPX,THRUSTMASTER 350CPX AUDIFONOS ALAMBRICOS  COLOR NEGRO EN CAJA DESGASTE POR USO,ver [1] fotos.,$ 483.00,$ 483.00,Nicolás Romero,55-4160-5743
26052415.1,AUDIFONOS (usado),SELECT SOUND,BTH0223,AUDIFONOS BLUETHOOT SELECT SOUND BTH0223 COLOR AZUL DESGASTE POR USO,ver [1] fotos.,$ 195.00,$ 195.00,Nicolás Romero,55-4160-5743
26052425.1,AUDIFONOS (usado),OTRA MARCA,S3PRO,AUDIFONO DIADEMA INALAMBRICOS OTRA MARCA(ONEDER) S3PRO COLOR NEGRO EN ESTUCHE DESGASTE POR USO,ver [1] fotos.,$ 923.00,$ 923.00,Nicolás Romero,55-4160-5743
26052468.1,AUDIFONOS (usado),HAYLOU,GT7NEO,AUDIFONOS HAYLOU GT7NEO COLOR NEGRO DETALLES DE USO,ver [1] fotos.,$ 265.00,$ 265.00,Nicolás Romero,55-4160-5743
26052597.1,AUDIFONOS (usado),HYPERX,SM,AUDIFONOS ALAMBRICOS PARA PS4 HYPERX SM CON CAJA DESGASTE POR USO,ver [1] fotos.,$ 583.00,$ 583.00,Nicolás Romero,55-4160-5743
26052736.1,AUDIFONOS (usado),PLANTRONICS,B6200,AUDÍFONOS DIADEMA PLANTRONICS B6200 CON ESTUCHE DESGASTE  POR USO,ver [1] fotos.,"$ 1,407.00","$ 1,407.00",Nicolás Romero,55-4160-5743
26052942.1,AUDIFONOS (usado),HUAWEI,T0010C,AUDÍFONOS INALÁMBRICOS HUAWEI T0010C COLOR BLANCO DESGASTE POR USO,ver [1] fotos.,$ 300.00,$ 300.00,Nicolás Romero,55-4160-5743
26053002.1,AUDIFONOS (usado),HUAWEI,SM,AUDIFONOS BLUETHOOT HUAWEI SM HUAWEI FREEBUDS 4I CON CABLE USB,ver [1] fotos.,$ 781.00,$ 781.00,Nicolás Romero,55-4160-5743
26053052.1,AUDIFONOS (usado),HONOR,ROSME01,AUDÍFONOS INALÁMBRICOS HONOR ROSME01 EN CAJA DESGASTE POR USO,ver [1] fotos.,$ 391.00,$ 391.00,Nicolás Romero,55-4160-5743
26053060.1,AUDIFONOS (usado),SM,SM,AUDIFONOS SM SM PARA JUEGOS EN CAJA,ver [1] fotos.,$ 90.00,$ 90.00,Nicolás Romero,55-4160-5743
26053060.2,AUDIFONOS (usado),SM,SM,AUDIFONOS SM SM PARA JUEGOS EN CAJA,ver [1] fotos.,$ 90.00,$ 90.00,Nicolás Romero,55-4160-5743
26053060.3,AUDIFONOS (usado),SM,SM,AUDIFONOS SM SM PARA JUEGOS EN CAJA,ver [1] fotos.,$ 90.00,$ 90.00,Nicolás Romero,55-4160-5743
26053060.4,AUDIFONOS (usado),SM,SM,AUDIFONOS SM SM PARA JUEGOS EN CAJA,ver [1] fotos,$ 90.00,$ 90.00,Nicolás Romero,55-4160-5743
26053060.5,AUDIFONOS (usado),SM,SM,AUDIFONOS SM SM PARA JUEGOS EN CAJA,ver [1] fotos,$ 90.00,$ 90.00,Nicolás Romero,55-4160-5743
26053065.1,AUDIFONOS (usado),SHOKZ,C110,AUDIFONOS OPENMOVE BONE CONDUCTION SHOKZ C110 EN CAJA DESGASTE POR USO,ver [1] fotos.,$ 681.00,$ 681.00,Nicolás Romero,55-4160-5743
26053187.1,AUDIFONOS (usado),STF,STH77576,AUDOFONOS INALAMBRIVOS DIADEMA STF STH77576 COLOR ROSA EN CAJA DESGASTE POR USO,ver [1] fotos,$ 251.00,$ 251.00,Nicolás Romero,55-4160-5743
26053236.1,AUDIFONOS (usado),MOTOROLA,BUDS085,"MOTOROLA BUDS085 , AUDIFONOS COLOR NEGRO BT, EN CAJA,CABLE USB, DESGASTE DE USO",ver [1] fotos.,$ 358.00,$ 358.00,Nicolás Romero,55-4160-5743
26053336.1,AUDIFONOS (usado),MITZU,MH8097BK,AUDIFONOS MITZU MH8097BK COLOR NEGRO INALAMBRICOS MARCAS DE USO,ver [1] fotos,$ 127.00,$ 127.00,Nicolás Romero,55-4160-5743
26053336.2,AUDIFONOS (usado),sin marca,SINMODELO,AURICULARES SIN MARCA SINMODELO COLOR NEGRO MARCAS DE USO,ver [1] fotos,$ 284.00,$ 284.00,Nicolás Romero,55-4160-5743
40043889.4,AUDIFONOS (usado),JABRA,ENC012,"JABRA ENC012 JABRA AUDÍFONOS CON MICRÓFONO, ALÁMBRICO COLOR NEGRO CON DETALLES POR USO",ver [1] fotos.,$ 132.00,$ 132.00,Nicolás Romero,55-4160-5743
40043889.6,AUDIFONOS (usado),JABRA,BIZ2300,JABRA BIZ2300 AUDIFONOS JABRA COLOR NEGRO ALAMBRICOS CON DETALLES POR USO,ver [1] fotos.,$ 132.00,$ 132.00,Nicolás Romero,55-4160-5743
40044041.4,AUDIFONOS (usado),JABRA,ENC012,JABRA ENC012 AUDIFONOS JABRA FUNCIONANDO,ver [1] fotos.,$ 115.00,$ 115.00,Nicolás Romero,55-4160-5743
22054368.1,AUDIFONOS (usado),APPLE,A2897,"AUDIFONOS AIRPODS 3 GENERACION APPLE A2897 , DETALLES DE USO, CON ESTUCHE DE CARGA, CHECADOS EN SUC",ver [1] fotos.,"$ 1,300.00","$ 1,300.00",Oaxaca Plaza Bella,800-022-6262
22054538.1,AUDIFONOS (usado),RAZER,KRAKENX,"AUDIFONOS GAMER ALAMBRICOS RAZER KRAKENX , SEMINUEVO, EN CAJA,CHECADO EN SUC",ver [1] fotos.,$ 994.00,$ 994.00,Oaxaca Plaza Bella,800-022-6262
22054685.1,AUDIFONOS (usado),SONY,SM,AURICULARES WF 1000 X SONY SM DETALLES DE USO CON CAJ A CABLE USB GOMAS DE REPUESTO,ver [1] fotos.,"$ 2,330.00","$ 2,330.00",Oaxaca Plaza Bella,800-022-6262
22054928.1,AUDIFONOS (usado),APPLE,A1602,"AUDIFONOS AIRPODS 1 GEN APPLE A1602 , DETALLES DE USO, CON CABLE, CHECADO EN SUC",ver [1] fotos.,$ 645.00,$ 645.00,Oaxaca Plaza Bella,800-022-6262
22055052.1,AUDIFONOS (usado),SELECT SOUND,BTH028,"AUDIFONOS INALAMABRICOS SELECT SOUND BTH028 , SEMINUEVO, EN CAJA, CHECADO EN SUC",ver [1] fotos,$ 227.00,$ 227.00,Oaxaca Plaza Bella,800-022-6262
67029324.1,AUDIFONOS (usado),JBL,ENDURANCEPEAKII,PAR DE AUDIFONOS EN ESTUCHE DESGASTE NATURAL POR USO JBL ENDURANCEPEAKII,ver [1] fotos.,"$ 1,168.00","$ 1,168.00",Oaxaca Plaza Bella,800-022-6262
67029636.1,AUDIFONOS (usado),JBL,ENDURANCEPEAK2,AUDIFONOS NEGROS INALAMBRICOS DESGASTE NATURAL POR USO JBL ENDURANCEPEAK2,ver [1] fotos.,"$ 1,035.00","$ 1,035.00",Oaxaca Plaza Bella,800-022-6262
67029913.2,AUDIFONOS (usado),JBL,ENDURANCEPEAK2,AUDIFONOS NEGROS EN ESTUCHE DE CARGA DESGASTE NATURAL POR USO JBL ENDURANCEPEAK2,ver [1] fotos.,"$ 1,474.00","$ 1,474.00",Oaxaca Plaza Bella,800-022-6262
21055002.1,AUDIFONOS (usado),BOSE,423729,BOSE SOUNDSPORT FREE WIRELESS EARBUDS BOSE 423729 SIN CABLE DE CARGA CON ESTUCHE CONDICIONES DE USO,ver [1] fotos.,"$ 1,500.00","$ 1,500.00",Patio Texcoco,55-4160-5731
21056020.2,AUDIFONOS (usado),LOGITECH,G35,"AUDIFONOS LOGITECH G35 COLOR NEGRO, ENTRADA USB, EN ESTADO DE USO",ver [1] fotos.,$ 479.00,$ 479.00,Patio Texcoco,55-4160-5731
21056020.3,AUDIFONOS (usado),SENNHEISER,SC230ML,"AUDIFONOS SENNHEISER SC230ML PARA LLAMADAS, COLOR NEGRO, ENTRADA USB, EN ESTADO DE USO",ver [1] fotos.,$ 600.00,$ 600.00,Patio Texcoco,55-4160-5731
21056205.1,AUDIFONOS (usado),SENNHEISER,CXPLUSTW1C,"AUDIFONOS SENNHEISER CXPLUSTW1C RECARGABLES, CON CAJA DE CARGA, CARGADOR, EN BUEN ESTADO, FUNCIONANDO",ver [1] fotos.,"$ 1,138.00","$ 1,138.00",Patio Texcoco,55-4160-5731
21056316.1,AUDIFONOS (usado),JBL,TUNEFLEX,AUDÍFONOS INALÁMBRICOS JBL TUNEFLEX COLOR MORADO,ver [1] fotos.,$ 613.00,$ 613.00,Patio Texcoco,55-4160-5731
21056673.1,AUDIFONOS (usado),REDMI,M2110E1,"AUDIFONOS REDMI M2110E1 COLOR NEGRO, ESTUCHE, SIN CABLE DE CONEXION",ver [1] fotos.,$ 334.00,$ 334.00,Patio Texcoco,55-4160-5731
21056973.1,AUDIFONOS (usado),BOSE,423729,"AUDIFONOS BOSE 423729 COLOR NEGROS, EN ESTUCHE, FUNCIONANDO, BUEN ESTADO",ver [1] fotos.,$ 900.00,$ 900.00,Patio Texcoco,55-4160-5731
21057427.2,AUDIFONOS (usado),SKULLCANDY,GROM,SKULLCANDY GROM,ver [1] fotos.,$ 516.00,$ 516.00,Patio Texcoco,55-4160-5731
78003700.1,AUDIFONOS (usado),SAMSUNG,SOUNDAKG,"AUDÍFONOS IN-EAR BLUETOOTH SAMSUNG GALAXY BUDS2 NEGRO, SAMSUNG SOUNDAKG , CON CABLE DE USB, GOMAS DE REPUESTO , USADO",ver [1] fotos.,"$ 1,336.00","$ 1,336.00",Playa del Carmen Plaza Sofia,998-504-0008
78004004.1,AUDIFONOS (usado),TURTLEBEACH,STEALTH500P,AUDIFONOS TURTLEBEACH STEALTH500P CON CABLE DE DATOS Y ADAPTADOR USB,ver [1] fotos,$ 514.00,$ 514.00,Playa del Carmen Plaza Sofia,998-504-0008
78004133.1,AUDIFONOS (usado),APPLE,A2897,"AUDIFONOS APPLE A2897 3RA GENERACION, C/FUNDA, C/CABLE, C/FUNDA, LIGEROS RASPONES, DETALLES DE USO",ver [1] fotos,"$ 1,689.00","$ 1,689.00",Playa del Carmen Plaza Sofia,998-504-0008
39041390.1,AUDIFONOS (usado),PLANTRONICS,EP320,PLANTRONICS EP320 AUDÍFONOS ALÁMBRICOS DE DIADEMA USB CON MICRÓFONO TIPO CALL CENTER CON DETALLES DE USO,ver [1] fotos.,$ 125.00,$ 125.00,Plaza Atizapán,55-4160-5651
39042146.1,AUDIFONOS (usado),JABRA,HSC024,JABRA HSC024 JABRA BIZ 1500 QD DUO AURICULARES ALÁMBRICO DIADEMA CON DETALLES DE USO,ver [1] fotos.,$ 312.00,$ 312.00,Plaza Atizapán,55-4160-5651
39042182.2,AUDIFONOS (usado),SONY,WFC500,SONY WFC500 AUDIFONOS INALAMBRICOS CON GOMAS EN CAJA CON DETALLES DE USO,ver [1] fotos.,$ 766.00,$ 766.00,Plaza Atizapán,55-4160-5651
39042390.1,AUDIFONOS (usado),MOTOROLA,BUDS250,MOTOROLA BUDS250 AUDÍFONOS MOTOROLA MOTO BUDS 250 CON CABLE EN CAJA EN BUEN ESTADO,ver [1] fotos.,$ 363.00,$ 363.00,Plaza Atizapán,55-4160-5651
39042426.1,AUDIFONOS (usado),HONOR,ORLME00,"HONOR ORLME00 HONOR CHOICE OPEN-EAR TRUE WIRELESS EARBUDS,AURICULARES BLUETOOTH EN CAJA",ver [1] fotos.,$ 621.00,$ 621.00,Plaza Atizapán,55-4160-5651
39042513.1,AUDIFONOS (usado),OTRA MARCA,NEXPNEWEXPERT,OTRA MARCA(LCDLC) NEXPNEWEXPERT AURICULARES INALÁMBRICOS EXPERT LA CASA DE LAS CARCASAS EN CAJA MARCAS DE USO,ver [1] fotos.,$ 434.00,$ 434.00,Plaza Atizapán,55-4160-5651
39043108.1,AUDIFONOS (usado),TZUMI,PROBUDS,TZUMI PROBUDS TZUMI PROBUDS COM EN ESTUCHE MARCAS DE USOI,ver [1] fotos.,$ 494.00,$ 494.00,Plaza Atizapán,55-4160-5651
39043160.1,AUDIFONOS (usado),JBL,TUNE720BT,"JBL TUNE720BT AURICULARES INALÁMBRICOS JBL TUNE 720BT BLUETOOTH AMV COLOR NEGRO EN CAJA , MANUAL CON DETALLES DE USO",ver [1] fotos.,$ 553.00,$ 553.00,Plaza Atizapán,55-4160-5651
39043234.1,AUDIFONOS (usado),RAZER,KRAKEN,RAZER KRAKEN RAZER KRAKEN RZ04 - AURICULARES GAMER EN CAJA MARCAS DE USO,ver [1] fotos.,$ 822.00,$ 822.00,Plaza Atizapán,55-4160-5651
39043282.2,AUDIFONOS (usado),ATVIO,TSX03R,ATVIO TSX03R AUDÍFONOS DE DIADEMA PLEGABLES CON MINI RADIO MARCAS DE USO,ver [1] fotos.,$ 207.00,$ 207.00,Plaza Atizapán,55-4160-5651
39043384.1,AUDIFONOS (usado),HAYLOU,S30,HAYLOU S30 HAYLOU S30 AUDÍFONOS INALÁMBRICOS EN CAJA SIN DETALLES APARENTES DE USO,ver [1] fotos.,$ 449.00,$ 449.00,Plaza Atizapán,55-4160-5651
39043416.1,AUDIFONOS (usado),OPPO,ETE41,OPPO ETE41 AURICULARES IN-EAR INALÁMBRICOS OPPO BUDS2 ETE41 ETE41 VERDE EN CAJA CON GOMAS DE REPUESTO SIN CABLE USB,ver [1] fotos.,$ 485.00,$ 485.00,Plaza Atizapán,55-4160-5651
39043422.2,AUDIFONOS (usado),OTRA MARCA,T2GO,OTRA MARCA(EVERYDAY) T2GO AUDIFONOS INALAMBRICO EN CAJA SIN MARCAS EVIDENTES DE USO,ver [1] fotos.,$ 331.00,$ 331.00,Plaza Atizapán,55-4160-5651
39043458.1,AUDIFONOS (usado),OPPO,SM,OPPO SM OPPO ENCO BUDS 2 COLOR VERDE CON CABLE USB  SIN DETALLES APARENTES DE USO,ver [1] fotos.,$ 841.00,$ 841.00,Plaza Atizapán,55-4160-5651
39043745.1,AUDIFONOS (usado),HUGO BOSS,28,HUGO BOSS 28 AUDÍFONOS EARBUDS CALIDAD HUGO BOSS CONTRA EL AGUA,ver [1] fotos.,"$ 1,236.00","$ 1,236.00",Plaza Atizapán,55-4160-5651
74013349.1,AUDIFONOS (usado),KINKETE,SM,KINKETE SM AUDIFONOS GAMER CON MICROFONO,ver [1] fotos.,$ 322.00,$ 322.00,Plaza Centenario,55-5985-0286
74013771.1,AUDIFONOS (usado),APPLE,A2699,APPLE A2699 AUDIFONOS TIPO AIRPODS,ver [1] fotos.,$ 600.00,$ 600.00,Plaza Centenario,55-5985-0286
74013958.1,AUDIFONOS (usado),MOTOROLA,085,MOTOROLA 085 AUDIFONOS INALAMBRICOS TIPO MOTOROLA EN CAJA,ver [1] fotos.,$ 400.00,$ 400.00,Plaza Centenario,55-5985-0286
74014044.1,AUDIFONOS (usado),HONOR,ROSMED01,HONOR ROSMED01 AUDIFONOS BLUETOOTH HONOR EN CAJA,ver [1] fotos.,$ 579.00,$ 579.00,Plaza Centenario,55-5985-0286
74014077.1,AUDIFONOS (usado),JBL,600BT,JBL 600BT AUDIFONOS JBL BLUETOOTH BLANCOS EN CAJA,ver [1] fotos.,$ 300.00,$ 300.00,Plaza Centenario,55-5985-0286
74014252.2,AUDIFONOS (usado),FINGERTIP,FINGERTIME,FINGERTIP FINGERTIME AUDIFONOS INALAMBRICOS FASHION FREE1,ver [1] fotos.,$ 370.00,$ 370.00,Plaza Centenario,55-5985-0286
74014252.3,AUDIFONOS (usado),QCY,H3,QCY H3 AUDIFONOS INALAMBRICOS QCY H3 EN CAJA,ver [1] fotos.,$ 340.00,$ 340.00,Plaza Centenario,55-5985-0286
34050877.5,AUDIFONOS (usado),OTRA MARCA,KTP22A,OTRA MARCA(BATMUSIC) KTP22A // AUDIFO0NOS BLUETOOTH // COLOR NEGRO // DET  XUSO,ver [1] fotos.,$ 89.00,$ 89.00,Plaza Chimalhuacán,55-4160-5658
34050959.2,AUDIFONOS (usado),POLY,3325,AUDIFONOS // POLY 3325 // EN CAJA // CAB DE AXULILAR /// COLRO NEGRO // DET X SUO,ver [1] fotos.,$ 315.00,$ 315.00,Plaza Chimalhuacán,55-4160-5658
34051118.1,AUDIFONOS (usado),JABRA,EVOLVE230SE,"JABRA EVOLVE230SE DIADEMA CON MICROFONO BINAURAL JABRA EVOLVE 30 II MS STEREO ALAMBRICO/ USB/ 3.5MM/ CANCELACION DE RUIDO/ COLOR NEGRO, 5399-823-309",ver [1] fotos.,$ 523.00,$ 523.00,Plaza Chimalhuacán,55-4160-5658
34051839.1,AUDIFONOS (usado),GARMIN,DEZI,OTRA MARCA(GARMIN) DEZI // AUDIFONO INDIVUDUAL // EN CAJA // CON CABLE AUXILIAR // CARBLE DE CARGA // BASE D EPARED // DEGS  XUSO,ver [1] fotos.,"$ 1,262.00","$ 1,262.00",Plaza Chimalhuacán,55-4160-5658
34051980.1,AUDIFONOS (usado),BOSE,423729,BOSE 423729 AURICULARES DEPORTIVOS INALÁMBRICOS COLOR NEGRO CABLE DE CARGA MARCAS DE USO,ver [1] fotos.,"$ 1,409.00","$ 1,409.00",Plaza Chimalhuacán,55-4160-5658
34052497.1,AUDIFONOS (usado),JLAB,FITSPORT3,JLAB FITSPORT3 AUDIFONOS DEPOTTIVOS COLOR NEGRO MARCAS DE USO,ver [1] fotos.,$ 631.00,$ 631.00,Plaza Chimalhuacán,55-4160-5658
34052497.2,AUDIFONOS (usado),JLAB,FITSPORT3,JLAB FITSPORT3 AUDIFONOS INALAMBRICOS DEPORTIVOS,ver [1] fotos.,$ 529.00,$ 529.00,Plaza Chimalhuacán,55-4160-5658
34052497.3,AUDIFONOS (usado),JLAB,FITSPORT3,JLAB FITSPORT3 AUFDIFONOS DEPORTIVOS INAÑLAMBRICOS NEGROS MARCAS DE USO,ver [1] fotos.,$ 529.00,$ 529.00,Plaza Chimalhuacán,55-4160-5658
34052497.4,AUDIFONOS (usado),JLAB,FITSPORT3,JLAB FITSPORT3 AUFDIFONOS DEPORTIVOS INAÑLAMBRICOS NEGROS MARCAS DE USO,ver [1] fotos.,$ 529.00,$ 529.00,Plaza Chimalhuacán,55-4160-5658
34052497.5,AUDIFONOS (usado),JLAB,FITSPORT3,JLAB FITSPORT3 AUFDIFONOS DEPORTIVOS INAÑLAMBRICOS NEGROS MARCAS DE USO,ver [1] fotos.,$ 521.00,$ 521.00,Plaza Chimalhuacán,55-4160-5658
34052544.1,AUDIFONOS (usado),JLAB,FITSPORT3,JLAB FITSPORT3 AUFDIFONOS DEPORTIVOS INAÑLAMBRICOS NEGROS MARCAS DE USO,ver [1] fotos.,$ 528.00,$ 528.00,Plaza Chimalhuacán,55-4160-5658
34052544.2,AUDIFONOS (usado),JLAB,FITSPORT3,JLAB FITSPORT3 AUFDIFONOS DEPORTIVOS INAÑLAMBRICOS NEGROS MARCAS DE USO,ver [1] fotos.,$ 524.00,$ 524.00,Plaza Chimalhuacán,55-4160-5658
34052544.3,AUDIFONOS (usado),JLAB,FITSPORT3,JLAB FITSPORT3 AUFDIFONOS DEPORTIVOS INAÑLAMBRICOS NEGROS MARCAS DE USO,ver [1] fotos.,$ 523.00,$ 523.00,Plaza Chimalhuacán,55-4160-5658
34052544.4,AUDIFONOS (usado),JLAB,FITSPORT3,JLAB FITSPORT3 AUFDIFONOS DEPORTIVOS INAÑLAMBRICOS NEGROS MARCAS DE USO,ver [1] fotos.,$ 641.00,$ 641.00,Plaza Chimalhuacán,55-4160-5658
34052544.5,AUDIFONOS (usado),JLAB,FITSPORT3,JLAB FITSPORT3 AUFDIFONOS DEPORTIVOS INAÑLAMBRICOS NEGROS MARCAS DE USO,ver [1] fotos.,$ 533.00,$ 533.00,Plaza Chimalhuacán,55-4160-5658
34053516.1,AUDIFONOS (usado),HUAWEI,SM,HUAWEI SM T0001C AUDIFONOS INALAMBRICOS COLOR BLANCO MARCAS DE USO,ver [1] fotos.,$ 557.00,$ 557.00,Plaza Chimalhuacán,55-4160-5658
34053555.1,AUDIFONOS (usado),RAZER,THRESHEER,RAZER THRESHEER // AUDIFONOS DE COLOR NEGRO CON MARCAS DE USO,ver [1] fotos.,"$ 1,436.00","$ 1,436.00",Plaza Chimalhuacán,55-4160-5658
34054048.2,AUDIFONOS (usado),HUAWEI,t0004l,"AUDIFONOS HUAWEI T0004L AUDIFONOS HUAWEI FREEBUDS 4,CON CARGADOR,DETALLES DE USO",ver [1] fotos.,$ 769.00,$ 769.00,Plaza Chimalhuacán,55-4160-5658
34054123.1,AUDIFONOS (usado),SONY,YY2950,SONY YY2950 AUDIFONOS BT COLOR NEGO EN CAJA MARCAS DE USO,ver [1] fotos.,"$ 1,895.00","$ 1,895.00",Plaza Chimalhuacán,55-4160-5658
34054143.1,AUDIFONOS (usado),SKULLCANDY,S6EVW,"AUDIFONOS SKULLCANDY S6EVW AUDIFONOS INALAMBRICOS,COLR GRIS,DETALLES DE USO",ver [1] fotos.,"$ 1,423.00","$ 1,423.00",Plaza Chimalhuacán,55-4160-5658
34054160.1,AUDIFONOS (usado),APPLE,A1602,APPLE A1602 // AUDIFONOS DE COLOR BLANCO CON MARCAS DE USO,ver [1] fotos.,"$ 1,250.00","$ 1,250.00",Plaza Chimalhuacán,55-4160-5658
34054192.1,AUDIFONOS (usado),JBL,JR300BT,JBL JR300BT AUDIFONOS JBL AZUL CON NARANJA CABLE DE CARGA DETALLES DE USO,ver [1] fotos.,$ 909.00,$ 909.00,Plaza Chimalhuacán,55-4160-5658
34054205.1,AUDIFONOS (usado),JBL,JR300BT,JBL JR300BT AUDIFONOS INALAMBRICOS DE DIADEA JBL AZUL CN NARAJA MARCAS DE USO,ver [1] fotos.,$ 592.00,$ 592.00,Plaza Chimalhuacán,55-4160-5658
34054243.1,AUDIFONOS (usado),APPLE,A1602,APPLE A1602 AIRPODS 2 GENERACION CON DETALLES DE USO SIN ACCESORIOS,ver [1] fotos.,"$ 1,271.00","$ 1,271.00",Plaza Chimalhuacán,55-4160-5658
34054243.2,AUDIFONOS (usado),APPLE,A1602,APPLE A1602 AIRPODS 2 GEN SIN ACCESORIOS MARCAS DE USO,ver [1] fotos.,"$ 1,154.00","$ 1,154.00",Plaza Chimalhuacán,55-4160-5658
34054257.1,AUDIFONOS (usado),JLAB,GOAIRSPORT,"AUDIFONOS JLAB GOAIRSPORT AUDIFONOS JLAB,INALAMBRICOS,EN ESTUCHE",ver [1] fotos.,$ 306.00,$ 306.00,Plaza Chimalhuacán,55-4160-5658
34054257.2,AUDIFONOS (usado),JLAB,GOAIRPOP,"AUDIFONOS JLAB GOAIRPOP AUDIFONOS INALAMBRICOS ,JLAB,EN ESTUCHE",ver [1] fotos.,$ 296.00,$ 296.00,Plaza Chimalhuacán,55-4160-5658
