Prenda / Sku Lote,Familia,Marca,Modelo,Descripción,Imagenes,Precio Venta,Precio Promoción,Tienda,Tel. Tienda
19046529.1,AUDIFONOS (usado),APPLE,A2700,"AUDIFONOS  PRO 2DA GENERACION, APPLE A2700 CON CAJA CABLE DE CARGA, MANUALES, Y GOMAS EXTRAS, DETALLES DE USO.",ver [1] fotos,"$ 2,835.00","$ 2,835.00",Puebla Plaza Centro Sur,800-022-6262
56026177.2,AUDIFONOS (usado),JBL,TUNE125TWS,JBL TUNE125TWS /ADIFONOS VIA BLUETOOW DETALLES DEUSO POR CONDCION.,ver [1] fotos.,$ 490.00,$ 490.00,Puebla Plaza Centro Sur,800-022-6262
56026177.3,AUDIFONOS (usado),JBL,TUNE125TWS,JBL TUNE125TWS /ADIFONOS VIA BLUETOOW DETALLES DEUSO POR CONDCION.,ver [1] fotos.,$ 496.00,$ 496.00,Puebla Plaza Centro Sur,800-022-6262
56026177.4,AUDIFONOS (usado),JBL,TUNE125TWS,JBL TUNE125TWS /ADIFONOS VIA BLUETOOW DETALLES DEUSO POR CONDCION.,ver [1] fotos.,$ 496.00,$ 496.00,Puebla Plaza Centro Sur,800-022-6262
89011370.1,AUDIFONOS (usado),LG,HBSFL7,"AUDIFONOS INALAMBRICOS LG, LG HBSFL7 , COLOR NEGRO, EN CAJA, MANUALES, S/CABLE DE CARGA, BUEN ESTADO",ver [1] fotos.,$ 800.00,$ 800.00,Puebla Plaza Centro Sur,800-022-6262
73022436.1,AUDIFONOS (usado),BEAST,A2924,BEAST A2924 AUDIFONOS INALAMBRICOS BLUETOOTH COLOR NEGROS CON CABLE DE CORRIENTE CON  ESTUCHE Y CAJA SE VERIFICA FUNCIONAMIENTO EN SUCURSAL,ver [1] fotos.,"$ 2,550.00","$ 2,550.00",Puerta Texcoco,55-4160-5892
73023220.1,AUDIFONOS (usado),APPLE,AIRPODSPRO,APPLE AIRPODSPRO // AIRPODS APPLE 2DA GEN // EN CAJA // DEGS  XUSO,ver [1] fotos.,"$ 1,425.00","$ 1,425.00",Puerta Texcoco,55-4160-5892
73023316.2,AUDIFONOS (usado),LYZON,BTV60,LYZON BTV60 / AUDIFONOS COLOR NEGOS // EN CAJA // CABLE DE CARGA // DESG X USO,ver [1] fotos.,$ 228.00,$ 228.00,Puerta Texcoco,55-4160-5892
73023461.1,AUDIFONOS (usado),HUAWEI,T0016L,HUAWEI T0016L // AUDIFONOS HUAWEI FREEBUDS SE 2 // COLOR AZUL // CON ESTUCHE // CABLE DE CARGA *// DEGS  XUSO :D,ver [1] fotos.,$ 391.00,$ 391.00,Puerta Texcoco,55-4160-5892
73023493.1,AUDIFONOS (usado),MICROSOFT,AUDIFONOS,"MICROSOFT AUDIFONOS DE DIADEMA COLOR NEGROS ENTRADA USB CON CONTROLADOR DE VOLUMEN Y CHAT, EN BUENAS CONBDICIONES, FUNCIONANDO.",ver [1] fotos.,$ 570.00,$ 570.00,Puerta Texcoco,55-4160-5892
73023514.1,AUDIFONOS (usado),SONY,MDRXB550,"SONY MDRXB550 AUDIFONOS COLOR AZUL DE CABLE, EN BUENAS CONDICIONES, FUNCIONANDO.",ver [1] fotos.,$ 539.00,$ 539.00,Puerta Texcoco,55-4160-5892
73023590.1,AUDIFONOS (usado),BEATS,BEATSSTUDIO,"BEATS BEATSSTUDIO PRO, AUDIFONOS EN ESTUCHE  COLOR CAFE CON CABLES DESGASTE DE USO NORMNAL",ver [1] fotos.,"$ 3,400.00","$ 3,400.00",Puerta Texcoco,55-4160-5892
73023713.1,AUDIFONOS (usado),HUAWEI,SM,"HUAWEI SM , AUDIFONOS COLOR MORADO CON CABLE  DESGASTE DE USO NORMAL",ver [1] fotos.,"$ 1,160.00","$ 1,160.00",Puerta Texcoco,55-4160-5892
73024130.1,AUDIFONOS (usado),SOUNDPEATS,SM,SOUNDPEATS SM AUDIFONOS SPUDSPEATS/ COLOR NEGRO/ CON CAMBIOS DE GOMA/ CON CARGADOR/ EN ESTUCHE/ EN CAJA/ SE CHECA FUNCIONAMIENDO/ DESGASTE POR USO :),ver [1] fotos.,$ 102.00,$ 102.00,Puerta Texcoco,55-4160-5892
73024155.1,AUDIFONOS (usado),VOLTEDGE,TX70,VOLTEDGE TX70 AUDIFONOS VOLTEDGE/ COLOR NEGRO/ EN ESTUCHE DE TELA/ CON CABLE PARA CONECTAR AL CELULAR/ SIN CARGADOR/ CON LUCES RGB/ SE CHECA FUNCIONAMIENTO/ EN BUEN ESTADO :),ver [1] fotos,$ 626.00,$ 626.00,Puerta Texcoco,55-4160-5892
73024251.1,AUDIFONOS (usado),MOTOROLA,XT24431,"MOTOROLA XT24431 MOTO BUDS BLANCOS, EN BUENAS CONDICIONES, CON CAJA, SE VERIFICA FUNCIONAMIENTO.",ver [1] fotos.,$ 653.00,$ 653.00,Puerta Texcoco,55-4160-5892
73024451.1,AUDIFONOS (usado),JBL,TUNE120TWS,"JBL TUNE120TWS AUDIFONOS JBL COLOR NEGRO, EN BUENAS CONDICIONES, FUNCIONANDO.",ver [1] fotos,$ 973.00,$ 973.00,Puerta Texcoco,55-4160-5892
73024451.2,AUDIFONOS (usado),JBL,TUNE125TWS,"JBL TUNE125TWS AUDIFONOS JBL COLOR ROSA CON BLANCO, EN BUEN ESTADO, FUNCIONANDO.",ver [1] fotos,$ 973.00,$ 973.00,Puerta Texcoco,55-4160-5892
73024451.3,AUDIFONOS (usado),JBL,TUNE120TWS,"JBL TUNE120TWS AUDIFONOS COLOR BLANCOS, EN BUEN ESTADO, FUNCIONANDO.",ver [1] fotos,$ 973.00,$ 973.00,Puerta Texcoco,55-4160-5892
73024588.1,AUDIFONOS (usado),APPLE,A3049,APPLE A3049 AIRPODS 2 PRO/ COLOR BLANCO/ EN CAJA/ CON CARGADOR/ SE VERIFICA FUNCIONAMIENTO/ EN BUEN ESTADO :),ver [1] fotos.,"$ 2,981.00","$ 2,981.00",Puerta Texcoco,55-4160-5892
276008512.1,AUDIFONOS (usado),OTRA MARCA,MD780I,AURICULARES OTRA MARCA(SOLIC) MD780I COLOR NEGRO CON DETALLES COLOR COBRE CON CABLE DETALLES DE USO EN PARTE DE ADENRO SIN AFECTAR FUNCIONAMIENTO,ver [1] fotos.,$ 197.00,$ 197.00,Recursos Hidráulicos Ecatepec,55-4160-6450
276008953.2,AUDIFONOS (usado),SKULLCANDY,EARBUDS,AUDIFONOS SKULLCANDY EARBUDS COLOR NEGRO CON CABLE PARA CARGAR SIN CAJA,ver [1] fotos.,$ 453.00,$ 453.00,Recursos Hidráulicos Ecatepec,55-4160-6450
276008995.1,AUDIFONOS (usado),SAMSUNG,SMR180,AUDÍFONOS SAMSUNG SMR180 COLOR ROJO CON CARGADOR LE FALTA UNA GOMA DETALLES DE USO,ver [1] fotos.,$ 610.00,$ 610.00,Recursos Hidráulicos Ecatepec,55-4160-6450
276009125.1,AUDIFONOS (usado),JVC,HAA11T,AUDÍFONOS JVC HAA11T COLOR NEGRO CON CARGADOR EN ESTUCHE DETALLES DE USO,ver [1] fotos.,$ 545.00,$ 545.00,Recursos Hidráulicos Ecatepec,55-4160-6450
276009137.1,AUDIFONOS (usado),OTRA MARCA,OTE921,"AUDÍFONO OTRA MARCA(BLUEPARROTT) OTE921 CANCELACIÓN DE RUIDO, BLUETOOTH/CABLE USB GNRC.",ver [1] fotos.,"$ 1,040.00","$ 1,040.00",Recursos Hidráulicos Ecatepec,55-4160-6450
276009301.1,AUDIFONOS (usado),SAMSUNG,SMR510,AUDIFONOS GALAXY BUDS 2 PRO SAMSUNG SMR510 COLOR BLANCO SIN CARGADOR,ver [1] fotos.,$ 557.00,$ 557.00,Recursos Hidráulicos Ecatepec,55-4160-6450
276009431.1,AUDIFONOS (usado),BOSE,QUIETCOMFORT.,AUDIFONOS BOSE QUIETCOMFORT. COLOR VERDE/FUNDA NEGRA/CABLE USB PARA CARGA/BLUETOOTH/EN CAJA/CANSELACION DE RUIDO,ver [1] fotos.,"$ 3,153.00","$ 3,153.00",Recursos Hidráulicos Ecatepec,55-4160-6450
276009434.1,AUDIFONOS (usado),HUAWEI,FREEBUDS4I,AUDÍFONOS BLUETOOTH HUAWEI FREEBUDS4I EN ESTUCHE COLOR BLANCO CON CABLE PARA CARGA/SIN CAJA,ver [1] fotos.,$ 550.00,$ 550.00,Recursos Hidráulicos Ecatepec,55-4160-6450
276009799.1,AUDIFONOS (usado),OPPO,ETE41,AUDÍFONOS OPPO ETE41 BLUETOOTH COLOR VERDE SIN CABLE DE CARGA EN CAJA,ver [1] fotos.,$ 315.00,$ 315.00,Recursos Hidráulicos Ecatepec,55-4160-6450
276010125.1,AUDIFONOS (usado),LG,HBSFN5W,AUDÍFONOS INALÁMBRICOS LG HBSFN5W BLANCO BLUETOOTH CON ESTUCHE EN CAJA SIN CABLE,ver [1] fotos.,$ 800.00,$ 800.00,Recursos Hidráulicos Ecatepec,55-4160-6450
276010270.1,AUDIFONOS (usado),MOTOROLA,XT24431,AUDIFONOS MOTOROLA XT24431 COLOR BLANCO,ver [1] fotos.,$ 500.00,$ 500.00,Recursos Hidráulicos Ecatepec,55-4160-6450
276010313.1,AUDIFONOS (usado),MOTOROLA,XT24431,AUDIFONOS MOTOROLA XT24431 COLOR AZUL CON CARGADOR EN ESTUCHE BLANCO,ver [1] fotos.,$ 450.00,$ 450.00,Recursos Hidráulicos Ecatepec,55-4160-6450
276010565.1,AUDIFONOS (usado),HUAWEI,T0014L,AUDIFONOS INALAMBRICOS HUAWEI T0014L COLOR NEGRO EN CAJA CON CABLE PARA CARGAR,ver [1] fotos.,$ 600.00,$ 600.00,Recursos Hidráulicos Ecatepec,55-4160-6450
276010622.2,AUDIFONOS (usado),PLANTRONICS,C3220,AUDIFONOS DE DIADEMA PLANTRONICS C3220 COLOR NEGRO CON NARANJA,ver [1] fotos,$ 350.00,$ 350.00,Recursos Hidráulicos Ecatepec,55-4160-6450
276010845.1,AUDIFONOS (usado),HUAWEI,T0019L,AUDIFONOS INALAMBRICOS HUAWEI T0019L COLOR BLANCO CON CAJA Y CABLE PRA CARGAR,ver [1] fotos.,$ 700.00,$ 700.00,Recursos Hidráulicos Ecatepec,55-4160-6450
276011064.1,AUDIFONOS (usado),SONY,WHCH510,SONY WHCH510,ver [1] fotos.,$ 556.00,$ 556.00,Recursos Hidráulicos Ecatepec,55-4160-6450
276011081.1,AUDIFONOS (usado),REDMI,BUDS3,AURICULARES REDMI BUDS3 COLOR NEGRO CON CARGADOR,ver [1] fotos.,$ 425.00,$ 425.00,Recursos Hidráulicos Ecatepec,55-4160-6450
276011122.2,AUDIFONOS (usado),MICROSOFT,1944,AUDIFONOS GAMER MICROSOFT 1944 COLOE NEGRO XON VERDE EN CAJA,ver [1] fotos.,"$ 1,371.00","$ 1,371.00",Recursos Hidráulicos Ecatepec,55-4160-6450
276011383.1,AUDIFONOS (usado),JBL,FREEX,AUDIFONOS JBL FREEX COLOR NEGRO CON TAPA ESTRELLADA NO AFECTA SU FUNCIONAMIENTO CON CABLE DE CARGA,ver [1] fotos,$ 540.00,$ 540.00,Recursos Hidráulicos Ecatepec,55-4160-6450
50048287.1,AUDIFONOS (usado),APPLE,A2096,APPLE A2096 AUDIFONOS AIRPODS MAX COLOR GRIS CON CABLE DE CARGA ALMOADILLAS Y CAJA,ver [1] fotos.,"$ 1,700.00","$ 1,700.00",San Cosme,55-4160-5841
50050994.1,AUDIFONOS (usado),JBL,JBLFREEX,JBL JBLFREEX AUDIFONOS JBL BT CON ESTUCHE DE CARGA Y CABLE USO DET USO,ver [1] fotos.,$ 576.00,$ 576.00,San Cosme,55-4160-5841
50051478.1,AUDIFONOS (usado),SKULLCANDY,CRUSHER,SKULLCANDY CRUSHER AUDIFONOS DE DIADEMA ALAMBRICOS NEGROS DET USO,ver [1] fotos.,$ 630.00,$ 630.00,San Cosme,55-4160-5841
50051618.1,AUDIFONOS (usado),BEATS,A2924,BEATS A2924 AUDIFONOS BEATS  PRO COLOR CAFE CON CABLE DE CARAGA DET USO EN GENERAL,ver [1] fotos.,"$ 1,600.00","$ 1,600.00",San Cosme,55-4160-5841
50051687.2,AUDIFONOS (usado),SM,SM,SM SM AUDIFONOS EN CAJA,ver [1] fotos.,$ 161.00,$ 161.00,San Cosme,55-4160-5841
50051924.1,AUDIFONOS (usado),JBL,TUNE125TWS,JBL TUNE125TWS AUDIFONOS JBL CON ESTUCHE DE CARGA MAGNETICA,ver [1] fotos.,$ 516.00,$ 516.00,San Cosme,55-4160-5841
50052191.1,AUDIFONOS (usado),MOTOROLA,XT24431,MOTOROLA XT24431 AUDIFONOS EN ESTUCHE DE CARGA DET USO,ver [1] fotos.,$ 600.00,$ 600.00,San Cosme,55-4160-5841
50052490.2,AUDIFONOS (usado),JBL,LIVE300TWS,JBL LIVE300TWS AUDIFONOS BT EN ESTUCHE DE CARGA NEGROS DET USO,ver [1] fotos.,"$ 1,054.00","$ 1,054.00",San Cosme,55-4160-5841
50052572.5,AUDIFONOS (usado),SAMSUNG,M20,SAMSUNG M20 AUDIFONOS COPIA DET USO,ver [1] fotos.,$ 77.00,$ 77.00,San Cosme,55-4160-5841
50052631.1,AUDIFONOS (usado),ONIKUMA,X15PRO,AUDIFONIOS GAMER ONIKUMA X15PRO CILOR NEGRO CON CAJA DTU,ver [1] fotos.,$ 250.00,$ 250.00,San Cosme,55-4160-5841
50052726.1,AUDIFONOS (usado),HAYLOU,S35ANC,HAYLOU S35ANC AUDIFONOS EN ESTUCHE  CON CABLE 3.5-3.5,ver [1] fotos.,$ 509.00,$ 509.00,San Cosme,55-4160-5841
50052770.2,AUDIFONOS (usado),SONY,YY2968,SONY YY2968 AUDIFONOS SONY,ver [1] fotos.,$ 477.00,$ 477.00,San Cosme,55-4160-5841
50052857.1,AUDIFONOS (usado),SM,SM,SM SM AUDIFONOS ZOMBIESCAT  EN CAJA,ver [1] fotos.,$ 377.00,$ 377.00,San Cosme,55-4160-5841
50053019.1,AUDIFONOS (usado),SM,M25,SM M25 AUDIFONOS M25 EN CAJA,ver [1] fotos.,$ 215.00,$ 215.00,San Cosme,55-4160-5841
50053177.1,AUDIFONOS (usado),LOGITECH,H390,AUDIFONOS DE DIADEMA LOGITECH H390 COLOR NEGRO USB ENCAJA DTU,ver [1] fotos.,$ 312.00,$ 312.00,San Cosme,55-4160-5841
50053214.1,AUDIFONOS (usado),MOTOROLA,XT24431,AUDIFONOS MOTOROLA XT24431 SIN ACCESORIOS,ver [1] fotos.,$ 506.00,$ 506.00,San Cosme,55-4160-5841
50053276.1,AUDIFONOS (usado),PLANTRONICS,POTE18,AUDIFONOS PLANTRONICS POTE18 VOYAGER 104 EN CAJA CON CABLE DE CARGA  EN BUENAS CONDICIONES,ver [1] fotos.,$ 897.00,$ 897.00,San Cosme,55-4160-5841
50053276.2,AUDIFONOS (usado),JBL,LIVE660,AUDIFONOS JBL LIVE660 DETALLES EN GOMAS DE AUDIFONOS CON CABLE DE CARGA,ver [1] fotos.,$ 876.00,$ 876.00,San Cosme,55-4160-5841
50053357.1,AUDIFONOS (usado),SONY,SM,SONY SM AUDIFONOS  SONY EN CAJA,ver [1] fotos.,$ 486.00,$ 486.00,San Cosme,55-4160-5841
59027367.1,AUDIFONOS (usado),APPLE,A1602,AUDÍFONOS APPLE A1602 EN COLOR BLANCOS CON ACCESORIOS EN CAJA,ver [1] fotos.,"$ 1,000.00","$ 1,000.00",San Felipe,55-5980-4928
59027676.1,AUDIFONOS (usado),APPLE,2862,AUDIFONOS APPLE 2862 EN ESTUCHE EN COLOR BLANCO DETALLE D EUSO,ver [1] fotos.,"$ 1,367.00","$ 1,367.00",San Felipe,55-5980-4928
59029011.1,AUDIFONOS (usado),SUDIO,N2,SUDIO N2 AURICULARES COLOR BLANCO CON CABLE PARA CARGAR DETALLES DE USO,ver [1] fotos.,$ 332.00,$ 332.00,San Felipe,55-5980-4928
59030238.4,AUDIFONOS (usado),MARLEY,POSITIVEVIBRATION2,AUDIFONOS MARLEY POSITIVEVIBRATION2 COLOR NEGRO CON CAJA DETALLES D EUSO,ver [1] fotos.,$ 472.00,$ 472.00,San Felipe,55-5980-4928
59030238.5,AUDIFONOS (usado),MARLEY,POSITIVEVIBRATION2,AUDIFONOS COLOR NEGRO CON CAJA DETALLES D EUSO MARLEY POSITIVEVIBRATION2,ver [1] fotos.,$ 472.00,$ 472.00,San Felipe,55-5980-4928
59030287.1,AUDIFONOS (usado),JBL,JBLFREE,AURICULARES JBL JBLFREE COLOR NEGRO CON CABLE DE CARGA DETALLES D EUSO,ver [1] fotos.,"$ 1,507.00","$ 1,507.00",San Felipe,55-5980-4928
59030419.1,AUDIFONOS (usado),APPLE,A1602,AUDIFONO AIRPODS APPLE A1602,ver [1] fotos.,$ 450.00,$ 450.00,San Felipe,55-5980-4928
59030566.1,AUDIFONOS (usado),SONY,SM,AUDIFONOS SONY SM COLOR ROJO CON CAJA DETALLES DE USO,ver [1] fotos.,$ 209.00,$ 209.00,San Felipe,55-5980-4928
59030566.3,AUDIFONOS (usado),SONY,SM,AUDIFONOS SONY SM COLOR ROJO CON NEGRO CAJA DETALLES D EUSO,ver [1] fotos.,$ 209.00,$ 209.00,San Felipe,55-5980-4928
59030566.4,AUDIFONOS (usado),SONY,SM,AUDIFONOS SONY SM CON CAJA DETAÑLLES DE USO,ver [1] fotos.,$ 209.00,$ 209.00,San Felipe,55-5980-4928
59030566.5,AUDIFONOS (usado),SONY,SM,SONY SM,ver [1] fotos.,$ 209.00,$ 209.00,San Felipe,55-5980-4928
59030597.1,AUDIFONOS (usado),JBL,SM,AURICULARES JBL SM COLOR NEGRO CON CARGADOR DETALLES D EUSO,ver [1] fotos.,"$ 1,485.00","$ 1,485.00",San Felipe,55-5980-4928
59031181.1,AUDIFONOS (usado),APPLE,A2096,AUDIFONOS AIR PROMAX APPLE A2096 COLOR BLANCO CO CAJA DETALLES DE USO,ver [1] fotos.,"$ 3,000.00","$ 3,000.00",San Felipe,55-5980-4928
59031244.5,AUDIFONOS (usado),SM,SM,AURICULARES SM SM OLOR NEGRO CON DETALLES D EUSO,ver [1] fotos.,$ 215.00,$ 215.00,San Felipe,55-5980-4928
59031244.6,AUDIFONOS (usado),SM,SM,AURICULARES SM SM COLOR BLANCO CON DETALLES D EUSO,ver [1] fotos.,$ 215.00,$ 215.00,San Felipe,55-5980-4928
59031468.1,AUDIFONOS (usado),HUAWEI,SM,AURICULARES HUAWEI SM COLOR NEGRO CON CAJA DTU,ver [1] fotos.,$ 286.00,$ 286.00,San Felipe,55-5980-4928
59031496.1,AUDIFONOS (usado),KOTIONEACH,SM,AUDIFONOS KOTIONEACH SM COLOR NEGRO CON ROJO DETALLES DE USO,ver [1] fotos.,$ 159.00,$ 159.00,San Felipe,55-5980-4928
59031650.1,AUDIFONOS (usado),STF,STH16451,AUDIFONOS STF STH16451 COLOR GRIS CON CABLE DE CARGA CAJA DTU,ver [1] fotos.,$ 128.00,$ 128.00,San Felipe,55-5980-4928
59031911.1,AUDIFONOS (usado),SM,SM,AUDIFONOS SM SM CON CAJA 3 PZS DTU,ver [1] fotos.,$ 281.00,$ 281.00,San Felipe,55-5980-4928
59031942.1,AUDIFONOS (usado),OPPO,ETE41,"AUDÍFONOS INTRAURALES BLUETOOTH OPPO ENCO AIR 2I, COLOR VERD OPPO ETE41 EN EMPAQUE ORIGIAL",ver [1] fotos.,$ 356.00,$ 356.00,San Felipe,55-5980-4928
59031976.1,AUDIFONOS (usado),SM,SM,AUDIFONOS TIPO MI TWS SM SM 3 PIEZAS EN CAJA CON CABLE,ver [1] fotos.,$ 265.00,$ 265.00,San Felipe,55-5980-4928
59031976.2,AUDIFONOS (usado),SM,SM,AUDIFONOS TIPO SAMSUN EN CAJA SM SM DOSPIEZAS DETALLES DE USO,ver [1] fotos.,$ 264.00,$ 264.00,San Felipe,55-5980-4928
59031976.3,AUDIFONOS (usado),SM,SM,AUDIFONOS CON ESTUCHE DE GATO EN CAJA DETALLES DE USO SM SM DOSPIEZAS,ver [1] fotos.,$ 265.00,$ 265.00,San Felipe,55-5980-4928
59031976.4,AUDIFONOS (usado),SM,SM,AUDIFONOS TIPO AIRPODS SM SM COLOR BLANCO EN CAJA DETALLES DE USO,ver [1] fotos.,$ 265.00,$ 265.00,San Felipe,55-5980-4928
59031978.1,AUDIFONOS (usado),APPLE,A2700,AIRPOD PRO 2 APPLE A2700 COLOR BLANCO SIN CARGADOR DETALLES DE USO,ver [1] fotos.,$ 905.00,$ 905.00,San Felipe,55-5980-4928
59032056.1,AUDIFONOS (usado),SONY,SM,LOTE DE AURICULARES Y AUDIFONOS SONY SM CON CAJA  (NUEVOS),ver [1] fotos.,"$ 1,608.00","$ 1,608.00",San Felipe,55-5980-4928
59032203.1,AUDIFONOS (usado),SM,TWS4,LOTE DE AUDIFONOS CON 3 CARGADORS  TIPO UNDERARMOUR SM TWS4,ver [1] fotos.,$ 807.00,$ 807.00,San Felipe,55-5980-4928
59032213.2,AUDIFONOS (usado),SM,XB950,"MINILOTE DE AUDIFONO SM XB950 TIPO APPLE, DETALLES DE USO",ver [1] fotos.,$ 271.00,$ 271.00,San Felipe,55-5980-4928
59032222.1,AUDIFONOS (usado),OPPO,SMM,AUDIFINOS OPPO SMM 5 PIEZAS CON CAJA  DTU,ver [1] fotos.,$ 430.00,$ 430.00,San Felipe,55-5980-4928
59032276.2,AUDIFONOS (usado),OTRA MARCA,T3PLUS,"AUDIGONO OTRA MARCA(PADMATE) T3PLUS ESTUCHE COLOR ROSA, DETALLES DE USO CON CABLE DETALLES DE USO",ver [1] fotos.,$ 506.00,$ 506.00,San Felipe,55-5980-4928
59032376.1,AUDIFONOS (usado),MOTOROLA,30765,"MOTOROLA, AURICULARES MOTO BUDS+ CON SOUND BY BOSE, DOS CONTROLADORES DINÁMICOS Y SONIDO DE OPTIMA RESOLUCIÓN, MOTOROLA 30765 EN CJA NUEVOS",ver [1] fotos.,"$ 1,100.00","$ 1,100.00",San Felipe,55-5980-4928
59032388.1,AUDIFONOS (usado),APPLE,A3050,AUDIFONOS AIRPODS APPLE A3050 EN CAJA COLOR BLANCO CON CABLE DETALLES DE USO,ver [1] fotos.,$ 953.00,$ 953.00,San Felipe,55-5980-4928
59032388.2,AUDIFONOS (usado),APPLE,A2897,AIRPODS APPLE A2897 CON CABLE COLOR BLANCO DETALLES DE USO,ver [1] fotos.,"$ 1,470.00","$ 1,470.00",San Felipe,55-5980-4928
59032388.3,AUDIFONOS (usado),APPLE,A2700,"AIRPODS APPLE A2700 CON CABLE, COLOR BLANCO DETALLES DE USO",ver [1] fotos.,"$ 1,176.00","$ 1,176.00",San Felipe,55-5980-4928
59032458.1,AUDIFONOS (usado),HUAWEI,FREEBUDSPRO,HUAWEI FREEBUDSPRO COLOR NEGRO SIN CABLE DETALLES DE USO,ver [1] fotos.,"$ 1,200.00","$ 1,200.00",San Felipe,55-5980-4928
59032542.1,AUDIFONOS (usado),APPLE,AIRPODSPRO,AUDIFONOS APPLE AIRPODSPRO EN COLOR BLANCOS CON CABLE DE CORRIENTE DETALLE POR USO,ver [1] fotos.,"$ 1,084.00","$ 1,084.00",San Felipe,55-5980-4928
59032555.1,AUDIFONOS (usado),SM,SM,"AUDIFONOS GAMER  ARPA SM SM AUDIFONOS GAMER, AUDÍFONOS DE DIADEMA, DIADEMA CON MICROFONO, AUDIFONOS XBOX PARA NINTENDO SWITCH, XBOX SERIES X, PS4, PS5, PC, MAC (BLANCO)",ver [1] fotos.,$ 273.00,$ 273.00,San Felipe,55-5980-4928
59032556.2,AUDIFONOS (usado),HONOR,EARBUDSX7I,AUDIFONO COLOR BLANCO AUDIFONOS HONOR EARBUDSX7I EN CAJA DETALLES DE USO,ver [1] fotos.,$ 548.00,$ 548.00,San Felipe,55-5980-4928
59032592.1,AUDIFONOS (usado),MARSHALL,MAJORIV,AUDIFONOS MARSHALL MAJORIV EN COLOR NEGRO CON ACCESORIOS EN CAJA BUEN FUNCIONAMIENTO DETALLE POR USO,ver [1] fotos.,"$ 1,222.00","$ 1,222.00",San Felipe,55-5980-4928
59032608.1,AUDIFONOS (usado),APPLE,A2700,AUDIFONO APPLE A2700 EN COLOR BLANCO CON CABLE EN CAJA DETALLE POR USO,ver [1] fotos.,"$ 1,050.00","$ 1,050.00",San Felipe,55-5980-4928
59032608.2,AUDIFONOS (usado),JBL,TWS7,AUDIFONOS JBL TWS7 EN CAJA DETALLE POR USO,ver [1] fotos.,"$ 1,306.00","$ 1,306.00",San Felipe,55-5980-4928
59032608.3,AUDIFONOS (usado),SONY,MDRXB950BT,AUDIFONOS INALAMBRICOS SONY MDRXB950BT,ver [1] fotos.,$ 342.00,$ 342.00,San Felipe,55-5980-4928
59032608.4,AUDIFONOS (usado),SM,SM,AUDIOFONOS SM SM EN CAJA DETALLE POR USO,ver [1] fotos.,$ 158.00,$ 158.00,San Felipe,55-5980-4928
59032662.1,AUDIFONOS (usado),SAMSUNG,F37,AUDIFONOS SAMSUNG F37 EN COLOR NEGRO CON CABLE BLANCO GENERICO DETALLE POR USOI,ver [1] fotos.,$ 483.00,$ 483.00,San Felipe,55-5980-4928
59032753.1,AUDIFONOS (usado),SM,SM,AUDIFONOS EN COLOR AZUL BUEN ESTADO SM SM,ver [1] fotos,$ 540.00,$ 540.00,San Felipe,55-5980-4928
59032753.2,AUDIFONOS (usado),SM,SM,AUDIFONO EN COLOR MAMEY BUEN ESTADO DETALLE POR USO SM SM,ver [1] fotos.,$ 752.00,$ 752.00,San Felipe,55-5980-4928
59032754.1,AUDIFONOS (usado),SM,SM,AUDIFONOS EN BUEN ESTADO SM SM SE CHECO FUNCIONAMIENTO DEL ARTICULO,ver [1] fotos.,$ 613.00,$ 613.00,San Felipe,55-5980-4928
59032782.1,AUDIFONOS (usado),SKULLCANDY,SSPRW,"AUDIFONOS SKULLCANDY SSPRW RIFF WIRELESS 2 COLOR VERDE CON ACCESORIOS EN CAJA, DETALLES DE USO",ver [1] fotos.,$ 543.00,$ 543.00,San Felipe,55-5980-4928
59032844.2,AUDIFONOS (usado),REALME,RMA2120,REALME RMA2120,ver [1] fotos.,$ 554.00,$ 554.00,San Felipe,55-5980-4928
59032965.1,AUDIFONOS (usado),HONOR,PRGME00,AUDIFONOS HONOR PRGME00 EN BUEN ESTADO,ver [1] fotos.,$ 395.00,$ 395.00,San Felipe,55-5980-4928
59032983.1,AUDIFONOS (usado),XIAOMI,VDL682723,AUDIFONOS XIAOMI VDL682723 DETALLES DE USO,ver [1] fotos.,$ 195.00,$ 195.00,San Felipe,55-5980-4928
59033076.5,AUDIFONOS (usado),WIRELESS,V05,AURICULARES INALÁMBRICOS DEPORTIVOS PARA CORRER WIRELESS V05,ver [1] fotos.,$ 163.00,$ 163.00,San Felipe,55-5980-4928
59033113.1,AUDIFONOS (usado),XBOX,5F4-00011,AUDIFONOS XBOX 5F4-00011 EN BUEN ESTADO,ver [1] fotos.,$ 439.00,$ 439.00,San Felipe,55-5980-4928
59033121.1,AUDIFONOS (usado),APPLE,A3050,AUDIFONOS APPLE A3050 EN BUEN ESTADO,ver [1] fotos.,"$ 1,262.00","$ 1,262.00",San Felipe,55-5980-4928
59033389.2,AUDIFONOS (usado),ONIKUMA,K2PRO,DIADEMA AUDIFONOS ALAMBRICOS ONIKUMA K2 PRO ONIKUMA K2PRO EN COLOR NEGRO CON ROJO CAJA  MALTRATADA,ver [1] fotos.,$ 393.00,$ 393.00,San Felipe,55-5980-4928
47038891.1,AUDIFONOS (usado),HUAWEI,SM,HUAWEI SM AUDIFONOPS INALAMBRICOS DETALLES POCOS DE USO FUNCIONANDO CORRECTAMENTE,ver [1] fotos.,$ 462.00,$ 462.00,Santiago Tianguistenco Toluca,015541604159
47039871.2,AUDIFONOS (usado),1HORA,SM,1HORA SM AUDIFONOS  DETALLES DE USO FUNCIONANDO CORRECTAMENTE,ver [1] fotos.,$ 290.00,$ 290.00,Santiago Tianguistenco Toluca,015541604159
47039983.1,AUDIFONOS (usado),SONY,WFSP800N,SONY WFSP800N AUDIFONOS SONY CON ESTUCHE Y CABEL DE CARGA FUNCIONANDO CORRECTAMENTE,ver [1] fotos.,"$ 1,032.00","$ 1,032.00",Santiago Tianguistenco Toluca,015541604159
47040119.1,AUDIFONOS (usado),APPLE,A2700,APPLE A2700 AIRPODS PRO 2DA GEN CON ESTUCHE DE CARGA MAGSAFE,ver [1] fotos.,"$ 1,294.00","$ 1,294.00",Santiago Tianguistenco Toluca,015541604159
47040228.1,AUDIFONOS (usado),GENERICA,SM,GENERICA SM AIR PODS CON CABLE DE CARGA NO ORIGINALES CON DESGASTE POR USO NO AFECTA SU FUNCION PRESTAMO,ver [1] fotos.,$ 321.00,$ 321.00,Santiago Tianguistenco Toluca,015541604159
47040395.1,AUDIFONOS (usado),MARSHALL,SM,MARSHALL SM AUDIFONOS MARSHAL MINOR 3 EN CAJA NUEVOS FUNCIONANDO CORRECTAMENTE,ver [1] fotos.,"$ 1,710.00","$ 1,710.00",Santiago Tianguistenco Toluca,015541604159
47040399.1,AUDIFONOS (usado),SONY,SM,SONY SM AUDIFONOS  DETALLES DE USO FUNCIONANDO CORRECTAMENTE,ver [1] fotos.,"$ 1,758.00","$ 1,758.00",Santiago Tianguistenco Toluca,015541604159
47040612.1,AUDIFONOS (usado),BEATS,BEATSSTUDIOPRO,BEATS BEATSSTUDIOPRO AUDIFONOS INALAMBRICOS Y ALAMBRICOS ENTRADA DE CARGADOR TIPO C Y ENTRADA 3.5 EN ESTUCHE,ver [1] fotos.,"$ 2,000.00","$ 2,000.00",Santiago Tianguistenco Toluca,015541604159
47040686.1,AUDIFONOS (usado),OPPO,E510A,OPPO E510A AIR PODS CON ESTUCHE DE CARGA CON POC DESGASTE POR USO NO AFECTA SU FUNCIONAMIENTO,ver [1] fotos.,$ 744.00,$ 744.00,Santiago Tianguistenco Toluca,015541604159
47040852.1,AUDIFONOS (usado),PANASONIC,RBHF520B,PANASONIC RBHF520B AUDIFONO EN BUEN ESTADO FUNCIONANDO CORRECTAMENTE,ver [1] fotos.,$ 400.00,$ 400.00,Santiago Tianguistenco Toluca,015541604159
47041083.1,AUDIFONOS (usado),TURTLEBEACH,hwbb0001,TURTLEBEACH HWBB0001 AUDIFONO EN BUEN ESTADO FUNCIONANDO CORRECTAMENTE,ver [1] fotos.,"$ 1,213.00","$ 1,213.00",Santiago Tianguistenco Toluca,015541604159
47041179.1,AUDIFONOS (usado),SAMSUNG,GSMR190,SAMSUNG GSMR190 AUDIFONOS DETALLES DE USO FUNCIONANDO CORRECTAMENTE,ver [1] fotos.,"$ 1,006.00","$ 1,006.00",Santiago Tianguistenco Toluca,015541604159
47041296.2,AUDIFONOS (usado),SAMSUNG,SMR400NZAAMXO,SAMSUNG SMR400NZAAMXO AUDIFONOS EN BUEN ESTADO FUNCIONANDO CORRECTAMENTE EN CAJA,ver [1] fotos.,"$ 1,541.00","$ 1,541.00",Santiago Tianguistenco Toluca,015541604159
47041310.2,AUDIFONOS (usado),REDMI,BUDS4,REDMI BUDS4 AURICULARES EDICION HARRY POTTER EN BUEN ESTADO FUNCIONANDO CORRECTAMENTE,ver [1] fotos.,$ 773.00,$ 773.00,Santiago Tianguistenco Toluca,015541604159
47041504.1,AUDIFONOS (usado),SONY,WHCH520,SONY WHCH520 AUDIFONO SIN CARGADOR CON POCO DESGASTE POR USO NO AFECTA SU FUNCIONAMIENTO,ver [1] fotos.,$ 436.00,$ 436.00,Santiago Tianguistenco Toluca,015541604159
205024931.1,AUDIFONOS (usado),SM,SM,AUDIFONOS SM SM ///AUDIFONOS BLANCOS BLUETOOTH SIN ACCESORIOS ///VERIFCADO ENS UCURSAL ///DETALLES DE USO,ver [1] fotos.,$ 208.00,$ 208.00,Serviplaza Iztapalapa,55-4160-5669
88019750.1,AUDIFONOS (usado),PLANTRONICS,ACD06,AUDIFONOS PLANTRONICS ACD06 /////CON CABLE DE CORIENTE CON DETALLES DE USO,ver [1] fotos.,$ 566.00,$ 566.00,Serviplaza Iztapalapa,55-4160-5669
88019750.2,AUDIFONOS (usado),JABRA,HSC018W,AUDIFONOS JABRA HSC018W ///////CON CABLE CON DETALLES DE USO,ver [1] fotos.,"$ 1,000.00","$ 1,000.00",Serviplaza Iztapalapa,55-4160-5669
88019829.1,AUDIFONOS (usado),JLAB,EPICAIRSPORTANC,AUDIFONOS JLAB EPICAIRSPORTANC //////CON DETALLES DE USO,ver [1] fotos.,$ 302.00,$ 302.00,Serviplaza Iztapalapa,55-4160-5669
88019912.2,AUDIFONOS (usado),OPPO,18,AUDIFONOS OPPO 18 /////SIN CABLE CON DETALLES DE USO,ver [1] fotos.,$ 486.00,$ 486.00,Serviplaza Iztapalapa,55-4160-5669
88020151.1,AUDIFONOS (usado),LG,MERIDIAN,AUDIFONOS LG MERIDIAN //////SIN CABLE CON PARTE DE ENFRETE DESPINTADO,ver [1] fotos.,$ 683.00,$ 683.00,Serviplaza Iztapalapa,55-4160-5669
88021089.1,AUDIFONOS (usado),JBL,TUNE225TWS0,AUDIFONOS JBL TUNE225TWS0 ////////CON CABLE CON DETALLES DE USO,ver [1] fotos.,$ 788.00,$ 788.00,Serviplaza Iztapalapa,55-4160-5669
88021089.2,AUDIFONOS (usado),JBL,TUNE125TWS0,AUDIFONOS JBL TUNE125TWS0 ////////CON CABLE CON DETALLES DE USO,ver [1] fotos.,$ 688.00,$ 688.00,Serviplaza Iztapalapa,55-4160-5669
88021142.3,AUDIFONOS (usado),JBL,TUNE225TWS,AUDIFONOS JBL TUNE225TWS RAY MAL EN CODNCIIONES DE USO CON CABLDE DE CARGA,ver [1] fotos.,$ 656.00,$ 656.00,Serviplaza Iztapalapa,55-4160-5669
88021272.1,AUDIFONOS (usado),LOGITECH,ZONEVIBE100,AUDIFONOS LOGITECH ZONEVIBE100 ///////CON CABLE CON CAJA CON DETALLES DE USO,ver [1] fotos.,"$ 1,009.00","$ 1,009.00",Serviplaza Iztapalapa,55-4160-5669
88021372.1,AUDIFONOS (usado),HONOR,ORLME00,AUDIFONOS HONOR ORLME00 ///////CON CABLE CON CAJA CON DETALLES DE USO,ver [1] fotos.,$ 566.00,$ 566.00,Serviplaza Iztapalapa,55-4160-5669
88021463.1,AUDIFONOS (usado),OTRA MARCA,BEOPLAYE8,"AUDIFONOS OTRA MARCA(BANG&OLUFSEN) BEOPLAYE8 DEBE INDICAR LA ""OTRA MARCA"" - OTRA MARCA(LA OTRA MARCA)////////CON DETALLES DE USO",ver [1] fotos.,"$ 2,379.00","$ 2,379.00",Serviplaza Iztapalapa,55-4160-5669
88021534.1,AUDIFONOS (usado),BOSE,423729,AUDIFONOS BOSE 423729 RAY MAL CON CABLE DE CARGA EN CODNCIIONES DE USO,ver [1] fotos.,"$ 1,611.00","$ 1,611.00",Serviplaza Iztapalapa,55-4160-5669
88021543.6,AUDIFONOS (usado),MOTOROLA,MOTOBUDS085,AUDIFONOS MOTOROLA MOTOBUDS085 /////CON CABLE CON DETALLES DE USO,ver [1] fotos.,$ 310.00,$ 310.00,Serviplaza Iztapalapa,55-4160-5669
88021556.1,AUDIFONOS (usado),OTRA MARCA,SM,AUDIFONOS OTRA MARCA(BOWERS&WILKINS) SM OTRA MARCA(LA OTRA MARCA)///////CON CABLE CON DETALLES DE USO,ver [1] fotos.,"$ 1,641.00","$ 1,641.00",Serviplaza Iztapalapa,55-4160-5669
